Authors,Author(s) ID,Title,Year,Source title,Volume,Issue,Art. No.,Page start,Page end,Page count,Cited by,DOI,Link,Affiliations,Authors with affiliations,Document Type,Access Type,Source,EID
"Lu Z., Long W., Guo Y.","57207322594;36792418900;57202708122;","Extreme Market Prediction for Trading Signal with Deep Recurrent Neural Network",2018,"Lecture Notes in Computer Science (including subseries Lecture Notes in Artificial Intelligence and Lecture Notes in Bioinformatics)","10861 LNCS",,,"410","418",,,"10.1007/978-3-319-93701-4_31","https://www.scopus.com/inward/record.uri?eid=2-s2.0-85049119150&doi=10.1007%2f978-3-319-93701-4_31&partnerID=40&md5=e9dfe727834895fa1e23279c9d434bba","School of Economics and Management, University of Chinese Academy of Sciences, Beijing, 100190, China; Research Center on Fictitious Economy and Data Science, Chinese Academy of Sciences, Beijing, 100190, China; Key Laboratory of Big Data Mining and Knowledge Management, Chinese Academy of Sciences, Beijing, 100190, China","Lu, Z., School of Economics and Management, University of Chinese Academy of Sciences, Beijing, 100190, China, Research Center on Fictitious Economy and Data Science, Chinese Academy of Sciences, Beijing, 100190, China, Key Laboratory of Big Data Mining and Knowledge Management, Chinese Academy of Sciences, Beijing, 100190, China; Long, W., School of Economics and Management, University of Chinese Academy of Sciences, Beijing, 100190, China, Research Center on Fictitious Economy and Data Science, Chinese Academy of Sciences, Beijing, 100190, China, Key Laboratory of Big Data Mining and Knowledge Management, Chinese Academy of Sciences, Beijing, 100190, China; Guo, Y., School of Economics and Management, University of Chinese Academy of Sciences, Beijing, 100190, China, Research Center on Fictitious Economy and Data Science, Chinese Academy of Sciences, Beijing, 100190, China, Key Laboratory of Big Data Mining and Knowledge Management, Chinese Academy of Sciences, Beijing, 100190, China",Conference Paper,,Scopus,2-s2.0-85049119150
"Arévalo A., Nino J., León D., Hernandez G., Sandoval J.","57190281278;57190225431;57195350225;35897064300;56311250400;","Deep Learning and Wavelets for High-Frequency Price Forecasting",2018,"Lecture Notes in Computer Science (including subseries Lecture Notes in Artificial Intelligence and Lecture Notes in Bioinformatics)","10861 LNCS",,,"385","399",,1,"10.1007/978-3-319-93701-4_29","https://www.scopus.com/inward/record.uri?eid=2-s2.0-85049058462&doi=10.1007%2f978-3-319-93701-4_29&partnerID=40&md5=cfb5d82e2667813903d00f48094cef66","Universidad Nacional de Colombia, Bogotá, Colombia; Universidad Externado de Colombia, Bogotá, Colombia","Arévalo, A., Universidad Nacional de Colombia, Bogotá, Colombia; Nino, J., Universidad Nacional de Colombia, Bogotá, Colombia; León, D., Universidad Externado de Colombia, Bogotá, Colombia; Hernandez, G., Universidad Nacional de Colombia, Bogotá, Colombia; Sandoval, J., Universidad Nacional de Colombia, Bogotá, Colombia",Conference Paper,,Scopus,2-s2.0-85049058462
"Zhang X., Tan Y.","57202682531;56098810800;","Deep stock ranker: A LSTM neural network model for stock selection",2018,"Lecture Notes in Computer Science (including subseries Lecture Notes in Artificial Intelligence and Lecture Notes in Bioinformatics)","10943 LNCS",,,"614","623",,,"10.1007/978-3-319-93803-5_58","https://www.scopus.com/inward/record.uri?eid=2-s2.0-85049044403&doi=10.1007%2f978-3-319-93803-5_58&partnerID=40&md5=ef63080563365f325992f2f047ace6bc","Key Laboratory of Machine Perception (MOE), Department of Machine Intelligence, School of Electronics Engineering and Computer Science, Peking University, Beijing, 100871, China","Zhang, X., Key Laboratory of Machine Perception (MOE), Department of Machine Intelligence, School of Electronics Engineering and Computer Science, Peking University, Beijing, 100871, China; Tan, Y., Key Laboratory of Machine Perception (MOE), Department of Machine Intelligence, School of Electronics Engineering and Computer Science, Peking University, Beijing, 100871, China",Conference Paper,,Scopus,2-s2.0-85049044403
"Sun S., Wei Y., Wang S.","57193552421;57194829641;35195168500;","AdaBoost-LSTM Ensemble Learning for Financial Time Series Forecasting",2018,"Lecture Notes in Computer Science (including subseries Lecture Notes in Artificial Intelligence and Lecture Notes in Bioinformatics)","10862 LNCS",,,"590","597",,1,"10.1007/978-3-319-93713-7_55","https://www.scopus.com/inward/record.uri?eid=2-s2.0-85049006277&doi=10.1007%2f978-3-319-93713-7_55&partnerID=40&md5=bee7c24b30308effb49836edb7ea9052","Academy of Mathematics and Systems Science, Chinese Academy of Sciences, Beijing, 100190, China; School of Economics and Management, University of Chinese Academy of Sciences, Beijing, 100190, China; Center for Forecasting Science, Chinese Academy of Sciences, Beijing, 100190, China","Sun, S., Academy of Mathematics and Systems Science, Chinese Academy of Sciences, Beijing, 100190, China, School of Economics and Management, University of Chinese Academy of Sciences, Beijing, 100190, China; Wei, Y., Academy of Mathematics and Systems Science, Chinese Academy of Sciences, Beijing, 100190, China, Center for Forecasting Science, Chinese Academy of Sciences, Beijing, 100190, China; Wang, S., Academy of Mathematics and Systems Science, Chinese Academy of Sciences, Beijing, 100190, China, School of Economics and Management, University of Chinese Academy of Sciences, Beijing, 100190, China, Center for Forecasting Science, Chinese Academy of Sciences, Beijing, 100190, China",Conference Paper,,Scopus,2-s2.0-85049006277
"Di Persio L., Honchar O.","57203636440;57192153071;","Multitask machine learning for financial forecasting",2018,"International Journal of Circuits, Systems and Signal Processing","12",,,"444","451",,,,"https://www.scopus.com/inward/record.uri?eid=2-s2.0-85046646074&partnerID=40&md5=f35899208c4ae7d702b8cac615059496","Dept. of Computer Science, University of Verona, Strada le Grazie 15, Verona, 37134, Italy","Di Persio, L., Dept. of Computer Science, University of Verona, Strada le Grazie 15, Verona, 37134, Italy; Honchar, O., Dept. of Computer Science, University of Verona, Strada le Grazie 15, Verona, 37134, Italy",Article,,Scopus,2-s2.0-85046646074
"Dixon M.","55982004900;","Sequence classification of the limit order book using recurrent neural networks",2018,"Journal of Computational Science","24",,,"277","286",,15,"10.1016/j.jocs.2017.08.018","https://www.scopus.com/inward/record.uri?eid=2-s2.0-85029623619&doi=10.1016%2fj.jocs.2017.08.018&partnerID=40&md5=5311234cd932b0c114e33e2798a435cb","Stuart School of Business, Illinois Institute of Technology, 10 West 35th Street, Chicago, IL  60616, United States","Dixon, M., Stuart School of Business, Illinois Institute of Technology, 10 West 35th Street, Chicago, IL  60616, United States",Article,,Scopus,2-s2.0-85029623619
"Liu C., Hou W., Liu D.","57194109538;8430631300;56562006300;","Foreign Exchange Rates Forecasting with Convolutional Neural Network",2017,"Neural Processing Letters","46","3",,"1095","1119",,4,"10.1007/s11063-017-9629-z","https://www.scopus.com/inward/record.uri?eid=2-s2.0-85018755109&doi=10.1007%2fs11063-017-9629-z&partnerID=40&md5=0ea1255d2dd983c984cbfc535647c7f4","School of Information Engineering, Zhengzhou University, Zhengzhou, 450001, China","Liu, C., School of Information Engineering, Zhengzhou University, Zhengzhou, 450001, China; Hou, W., School of Information Engineering, Zhengzhou University, Zhengzhou, 450001, China; Liu, D., School of Information Engineering, Zhengzhou University, Zhengzhou, 450001, China",Article,,Scopus,2-s2.0-85018755109
"Selvin S., Vinayakumar R., Gopalakrishnan E.A., Menon V.K., Soman K.P.","57191042609;56755324000;43761171400;56872448100;57205365723;","Stock price prediction using LSTM, RNN and CNN-sliding window model",2017,"2017 International Conference on Advances in Computing, Communications and Informatics, ICACCI 2017","2017-January",,,"1643","1647",,16,"10.1109/ICACCI.2017.8126078","https://www.scopus.com/inward/record.uri?eid=2-s2.0-85042664127&doi=10.1109%2fICACCI.2017.8126078&partnerID=40&md5=2a94646ff60f434ad6dcdbfd32e95fef","Centre for Computational Engineering and Networking (CEN), Amrita School of Engineering, Coimbatore Amrita Vishwa Vidyapeetham, Amrita University, India","Selvin, S., Centre for Computational Engineering and Networking (CEN), Amrita School of Engineering, Coimbatore Amrita Vishwa Vidyapeetham, Amrita University, India; Vinayakumar, R., Centre for Computational Engineering and Networking (CEN), Amrita School of Engineering, Coimbatore Amrita Vishwa Vidyapeetham, Amrita University, India; Gopalakrishnan, E.A., Centre for Computational Engineering and Networking (CEN), Amrita School of Engineering, Coimbatore Amrita Vishwa Vidyapeetham, Amrita University, India; Menon, V.K., Centre for Computational Engineering and Networking (CEN), Amrita School of Engineering, Coimbatore Amrita Vishwa Vidyapeetham, Amrita University, India; Soman, K.P., Centre for Computational Engineering and Networking (CEN), Amrita School of Engineering, Coimbatore Amrita Vishwa Vidyapeetham, Amrita University, India",Conference Paper,,Scopus,2-s2.0-85042664127
"Korczak J., Hemes M.","7004001261;57200141372;","Deep learning for financial time series forecasting in A-Trader system",2017,"Proceedings of the 2017 Federated Conference on Computer Science and Information Systems, FedCSIS 2017",,, 8104660,"905","912",,9,"10.15439/2017F449","https://www.scopus.com/inward/record.uri?eid=2-s2.0-85039923580&doi=10.15439%2f2017F449&partnerID=40&md5=5a321a8a091cedb80c2190816a635a7e","Wrocław University of Economics, ul. Komandorska 118/120, Wrocław, 53-345, Poland","Korczak, J., Wrocław University of Economics, ul. Komandorska 118/120, Wrocław, 53-345, Poland; Hemes, M., Wrocław University of Economics, ul. Komandorska 118/120, Wrocław, 53-345, Poland",Conference Paper,Open Access,Scopus,2-s2.0-85039923580
"Afolabi D., Guan S.-U., Man K.L., Wong P.W.H., Zhao X.","55791007800;56000571900;55536496100;9734871500;57191226824;","Hierarchical meta-learning in time series forecasting for improved interference-less machine learning",2017,"Symmetry","9","11", 283,"","",,3,"10.3390/sym9110283","https://www.scopus.com/inward/record.uri?eid=2-s2.0-85034773068&doi=10.3390%2fsym9110283&partnerID=40&md5=40838d250615bc05ce2d3c76af4b9498","Department of Computer Science and Software Engineering, Xi'an Jiaotong-Liverpool University, Suzhou, 215123, China; Department of Computer Science, University of Liverpool, Liverpool, L69 3BX, United Kingdom","Afolabi, D., Department of Computer Science and Software Engineering, Xi'an Jiaotong-Liverpool University, Suzhou, 215123, China, Department of Computer Science, University of Liverpool, Liverpool, L69 3BX, United Kingdom; Guan, S.-U., Department of Computer Science and Software Engineering, Xi'an Jiaotong-Liverpool University, Suzhou, 215123, China; Man, K.L., Department of Computer Science and Software Engineering, Xi'an Jiaotong-Liverpool University, Suzhou, 215123, China; Wong, P.W.H., Department of Computer Science, University of Liverpool, Liverpool, L69 3BX, United Kingdom; Zhao, X., Department of Computer Science and Software Engineering, Xi'an Jiaotong-Liverpool University, Suzhou, 215123, China, Department of Computer Science, University of Liverpool, Liverpool, L69 3BX, United Kingdom",Article,Open Access,Scopus,2-s2.0-85034773068
"Chen W., Zhang Y., Yeo C.K., Lau C.T., Lee B.S.","57188997356;56825288900;7102545548;7401968617;56883413700;","Stock market prediction using neural network through news on online social networks",2017,"2017 International Smart Cities Conference, ISC2 2017",,, 8090834,"","",,7,"10.1109/ISC2.2017.8090834","https://www.scopus.com/inward/record.uri?eid=2-s2.0-85039937089&doi=10.1109%2fISC2.2017.8090834&partnerID=40&md5=b7eb0c3e8525dce5df0c24fc645c9ad0","School of Computer Science and Engineering, Nanyang Technological University, Singapore, S639798, Singapore","Chen, W., School of Computer Science and Engineering, Nanyang Technological University, Singapore, S639798, Singapore; Zhang, Y., School of Computer Science and Engineering, Nanyang Technological University, Singapore, S639798, Singapore; Yeo, C.K., School of Computer Science and Engineering, Nanyang Technological University, Singapore, S639798, Singapore; Lau, C.T., School of Computer Science and Engineering, Nanyang Technological University, Singapore, S639798, Singapore; Lee, B.S., School of Computer Science and Engineering, Nanyang Technological University, Singapore, S639798, Singapore",Conference Paper,,Scopus,2-s2.0-85039937089
"Tsantekidis A., Passalis N., Tefas A., Kanniainen J., Gabbouj M., Iosifidis A.","57195636516;56897101400;6701672908;23394868200;7005332419;36720841400;","Using deep learning to detect price change indications in financial markets",2017,"25th European Signal Processing Conference, EUSIPCO 2017","2017-January",, 8081663,"2511","2515",,11,"10.23919/EUSIPCO.2017.8081663","https://www.scopus.com/inward/record.uri?eid=2-s2.0-85041471618&doi=10.23919%2fEUSIPCO.2017.8081663&partnerID=40&md5=e72dae24bfa282d0e93feec563c60389","Department of Informatics, Aristotle University of Thessaloniki, Thessaloniki, Greece; Laboratory of Industrial and Information Management, Tampere University of Technology, Tampere, Finland; Laboratory of Signal Processing, Tampere University of Technology, Tampere, Finland; Department of Engineering, Electrical and Computer Engineering, Aarhus University, Denmark","Tsantekidis, A., Department of Informatics, Aristotle University of Thessaloniki, Thessaloniki, Greece; Passalis, N., Department of Informatics, Aristotle University of Thessaloniki, Thessaloniki, Greece; Tefas, A., Department of Informatics, Aristotle University of Thessaloniki, Thessaloniki, Greece; Kanniainen, J., Laboratory of Industrial and Information Management, Tampere University of Technology, Tampere, Finland; Gabbouj, M., Laboratory of Signal Processing, Tampere University of Technology, Tampere, Finland; Iosifidis, A., Laboratory of Signal Processing, Tampere University of Technology, Tampere, Finland, Department of Engineering, Electrical and Computer Engineering, Aarhus University, Denmark",Conference Paper,,Scopus,2-s2.0-85041471618
"Dingli A., Fournier K.S.","7801315512;57197812381;","Financial time series forecasting - a deep learning approach",2017,"International Journal of Machine Learning and Computing","7","5",,"118","122",,2,"10.18178/ijmlc.2017.7.5.632","https://www.scopus.com/inward/record.uri?eid=2-s2.0-85035056992&doi=10.18178%2fijmlc.2017.7.5.632&partnerID=40&md5=e1437833f03c6f5df40481ce9ac800e9","Department of Artificial Intelligence, University of Malta, Malta","Dingli, A., Department of Artificial Intelligence, University of Malta, Malta; Fournier, K.S., Department of Artificial Intelligence, University of Malta, Malta",Article,Open Access,Scopus,2-s2.0-85035056992
"Rout A.K., Dash P.K., Dash R., Bisoi R.","55602137700;7102314306;42560989800;54941427900;","Forecasting financial time series using a low complexity recurrent neural network and evolutionary learning approach",2017,"Journal of King Saud University - Computer and Information Sciences","29","4",,"536","552",,14,"10.1016/j.jksuci.2015.06.002","https://www.scopus.com/inward/record.uri?eid=2-s2.0-85006230902&doi=10.1016%2fj.jksuci.2015.06.002&partnerID=40&md5=73c576be060a20cd37a90f84a9e1a22d","G.M.R. Institute of Technology, Rajam, Andhra Pradesh, India; S.O.A. University, Bhubaneswar, India","Rout, A.K., G.M.R. Institute of Technology, Rajam, Andhra Pradesh, India; Dash, P.K., S.O.A. University, Bhubaneswar, India; Dash, R., S.O.A. University, Bhubaneswar, India; Bisoi, R., S.O.A. University, Bhubaneswar, India",Article,Open Access,Scopus,2-s2.0-85006230902
"Singh R., Srivastava S.","57202825807;57192430115;","Stock prediction using deep learning",2017,"Multimedia Tools and Applications","76","18",,"18569","18584",,16,"10.1007/s11042-016-4159-7","https://www.scopus.com/inward/record.uri?eid=2-s2.0-85006504040&doi=10.1007%2fs11042-016-4159-7&partnerID=40&md5=d5a422175c2383460758ac58c479e5b4","Indian School of Mines, Dhanbad, India; Faculty of Management Studies, Banaras Hindu University, Varanasi, India","Singh, R., Indian School of Mines, Dhanbad, India; Srivastava, S., Faculty of Management Studies, Banaras Hindu University, Varanasi, India",Article,,Scopus,2-s2.0-85006504040
"Tsantekidis A., Passalis N., Tefas A., Kanniainen J., Gabbouj M., Iosifidis A.","57195636516;56897101400;6701672908;23394868200;7005332419;36720841400;","Forecasting stock prices from the limit order book using convolutional neural networks",2017,"Proceedings - 2017 IEEE 19th Conference on Business Informatics, CBI 2017","1",, 8010701,"7","12",,20,"10.1109/CBI.2017.23","https://www.scopus.com/inward/record.uri?eid=2-s2.0-85029406625&doi=10.1109%2fCBI.2017.23&partnerID=40&md5=022dc1842b9f21a67fdfe96c9ec1389e","Department of Informatics, Aristotle University of Thessaloniki, Thessaloniki, Greece; Laboratory of Industrial and Information Management, Tampere University of Technology, Tampere, Finland; Laboratory of Signal Processing, Tampere University of Technology, Tampere, Finland","Tsantekidis, A., Department of Informatics, Aristotle University of Thessaloniki, Thessaloniki, Greece, Laboratory of Signal Processing, Tampere University of Technology, Tampere, Finland; Passalis, N., Department of Informatics, Aristotle University of Thessaloniki, Thessaloniki, Greece; Tefas, A., Department of Informatics, Aristotle University of Thessaloniki, Thessaloniki, Greece; Kanniainen, J., Laboratory of Industrial and Information Management, Tampere University of Technology, Tampere, Finland; Gabbouj, M., Laboratory of Signal Processing, Tampere University of Technology, Tampere, Finland; Iosifidis, A., Laboratory of Signal Processing, Tampere University of Technology, Tampere, Finland",Conference Paper,,Scopus,2-s2.0-85029406625
"Li J., Bu H., Wu J.","57195521810;57204073569;35313047900;","Sentiment-aware stock market prediction: A deep learning method",2017,"14th International Conference on Services Systems and Services Management, ICSSSM 2017 - Proceedings",,, 7996306,"","",,8,"10.1109/ICSSSM.2017.7996306","https://www.scopus.com/inward/record.uri?eid=2-s2.0-85028594302&doi=10.1109%2fICSSSM.2017.7996306&partnerID=40&md5=99179627230cde5a49e9d3dfd45cc154","School of Economics and Management, Beihang University, Beijing, China","Li, J., School of Economics and Management, Beihang University, Beijing, China; Bu, H., School of Economics and Management, Beihang University, Beijing, China; Wu, J., School of Economics and Management, Beihang University, Beijing, China",Conference Paper,,Scopus,2-s2.0-85028594302
"Chen J.-F., Chen W.-L., Huang C.-P., Huang S.-H., Chen A.-P.","57195363174;57195360094;57195361498;8882763200;21741959100;","Financial time-series data analysis using deep convolutional neural networks",2017,"Proceedings - 2016 7th International Conference on Cloud Computing and Big Data, CCBD 2016",,, 7979885,"87","92",,14,"10.1109/CCBD.2016.027","https://www.scopus.com/inward/record.uri?eid=2-s2.0-85027469207&doi=10.1109%2fCCBD.2016.027&partnerID=40&md5=a67ab301d59ba5c3b7b50025c082a600","Institute of Information Management, National Chiao Tung University, HsinChu, Taiwan; Department of Information Management and Finance, National Chiao Tung University, HsinChu, Taiwan","Chen, J.-F., Institute of Information Management, National Chiao Tung University, HsinChu, Taiwan; Chen, W.-L., Institute of Information Management, National Chiao Tung University, HsinChu, Taiwan; Huang, C.-P., Institute of Information Management, National Chiao Tung University, HsinChu, Taiwan; Huang, S.-H., Department of Information Management and Finance, National Chiao Tung University, HsinChu, Taiwan; Chen, A.-P., Department of Information Management and Finance, National Chiao Tung University, HsinChu, Taiwan",Conference Paper,,Scopus,2-s2.0-85027469207
[No author name available],[No author id available],"IEEE Conference on Evolving and Adaptive Intelligent Systems",2017,"IEEE Conference on Evolving and Adaptive Intelligent Systems","2017-May",,,"","",189,,,"https://www.scopus.com/inward/record.uri?eid=2-s2.0-85054328670&partnerID=40&md5=01aeebb42a76f5e1c4b9bc73977eb1e0",,"",Conference Review,,Scopus,2-s2.0-85054328670
"Zhang G., Xu L., Xue Y.","56670483600;7404745474;56278752300;","Model and forecast stock market behavior integrating investor sentiment analysis and transaction data",2017,"Cluster Computing","20","1",,"789","803",,7,"10.1007/s10586-017-0803-x","https://www.scopus.com/inward/record.uri?eid=2-s2.0-85014019024&doi=10.1007%2fs10586-017-0803-x&partnerID=40&md5=4c82e6feed2758a33b15f83ef6379745","Department of Computer Science, Shanghai University, Shanghai, China","Zhang, G., Department of Computer Science, Shanghai University, Shanghai, China; Xu, L., Department of Computer Science, Shanghai University, Shanghai, China; Xue, Y., Department of Computer Science, Shanghai University, Shanghai, China",Article,,Scopus,2-s2.0-85014019024
"Galeshchuk S., Mukherjee S.","56205106000;7401816816;","Deep learning for predictions in emerging currency markets",2017,"ICAART 2017 - Proceedings of the 9th International Conference on Agents and Artificial Intelligence","2",,,"681","686",,1,,"https://www.scopus.com/inward/record.uri?eid=2-s2.0-85049629999&partnerID=40&md5=a3c1ba4d0f298a8351732fa99aff9f28","Department of Accounting and Audit, Ternopil National Economic University, Ternopil, Ukraine; Laboratoire d'Informatique de Grenoble, Université Grenoble Alpes, Grenoble, France; College of Engineering and Computing, Nova Southeastern University, Fort Lauderdale, United States","Galeshchuk, S., Department of Accounting and Audit, Ternopil National Economic University, Ternopil, Ukraine, Laboratoire d'Informatique de Grenoble, Université Grenoble Alpes, Grenoble, France; Mukherjee, S., College of Engineering and Computing, Nova Southeastern University, Fort Lauderdale, United States",Conference Paper,,Scopus,2-s2.0-85049629999
[No author name available],[No author id available],"European Conference on Machine Learning and Principles and Practice of Knowledge Discovery in Databases, ECML PKDD 2017",2017,"Lecture Notes in Computer Science (including subseries Lecture Notes in Artificial Intelligence and Lecture Notes in Bioinformatics)","10534 LNAI",,,"","",2148,,,"https://www.scopus.com/inward/record.uri?eid=2-s2.0-85040242291&partnerID=40&md5=a7a65e443a16cff6d1c61a1d907239d2",,"",Conference Review,,Scopus,2-s2.0-85040242291
[No author name available],[No author id available],"European Conference on Machine Learning and Principles and Practice of Knowledge Discovery in Databases, ECML PKDD 2017",2017,"Lecture Notes in Computer Science (including subseries Lecture Notes in Artificial Intelligence and Lecture Notes in Bioinformatics)","10536 LNAI",,,"","",2148,,,"https://www.scopus.com/inward/record.uri?eid=2-s2.0-85040239499&partnerID=40&md5=d2f5bab544cd2ac30e493b31f3af12df",,"",Conference Review,,Scopus,2-s2.0-85040239499
[No author name available],[No author id available],"European Conference on Machine Learning and Principles and Practice of Knowledge Discovery in Databases, ECML PKDD 2017",2017,"Lecture Notes in Computer Science (including subseries Lecture Notes in Artificial Intelligence and Lecture Notes in Bioinformatics)","10535 LNAI",,,"","",2148,,,"https://www.scopus.com/inward/record.uri?eid=2-s2.0-85040219278&partnerID=40&md5=c576adf904170bd84e4268344e09d298",,"",Conference Review,,Scopus,2-s2.0-85040219278
"Yu H., Xu L., Zhang G.","57197735758;7404745474;56670483600;","A convolutional neural network based approach for stock forecasting",2017,"Lecture Notes in Computer Science (including subseries Lecture Notes in Artificial Intelligence and Lecture Notes in Bioinformatics)","10614 LNCS",,,"731","732",,1,"10.1007/978-3-319-68612-7","https://www.scopus.com/inward/record.uri?eid=2-s2.0-85034241812&doi=10.1007%2f978-3-319-68612-7&partnerID=40&md5=8326b77ee3960deaa3eb0efe915413d1","Department of Computer Science, Shanghai University, Shanghai, China; Shanghai Advanced Research Institute, Chinese Academy of Sciences, Beijing, China","Yu, H., Department of Computer Science, Shanghai University, Shanghai, China; Xu, L., Department of Computer Science, Shanghai University, Shanghai, China; Zhang, G., Shanghai Advanced Research Institute, Chinese Academy of Sciences, Beijing, China",Conference Paper,,Scopus,2-s2.0-85034241812
"Borovykh A., Bohte S., Oosterlee C.W.","57193126885;55893905100;6701797256;","Conditional time series forecasting with convolutional neural networks",2017,"Lecture Notes in Computer Science (including subseries Lecture Notes in Artificial Intelligence and Lecture Notes in Bioinformatics)","10614 LNCS",,,"729","730",,3,"10.1007/978-3-319-68612-7","https://www.scopus.com/inward/record.uri?eid=2-s2.0-85034213008&doi=10.1007%2f978-3-319-68612-7&partnerID=40&md5=39baac8a922fc20224c92664d71a4919","Dipartimento di Matematica, Università di Bologna, Bologna, Italy; Centrum Wiskunde and Informatica, Amsterdam, Netherlands; Delft University of Technology, Delft, Netherlands","Borovykh, A., Dipartimento di Matematica, Università di Bologna, Bologna, Italy; Bohte, S., Centrum Wiskunde and Informatica, Amsterdam, Netherlands; Oosterlee, C.W., Delft University of Technology, Delft, Netherlands",Conference Paper,,Scopus,2-s2.0-85034213008
