Authors,Author(s) ID,Title,Year,Source title,Volume,Issue,Art. No.,Page start,Page end,Page count,Cited by,DOI,Link,Affiliations,Authors with affiliations,Document Type,Access Type,Source,EID
"Hajiabotorabi Z., Kazemi A., Samavati F.F., Maalek Ghaini F.M.","57210187197;24070754400;6603142390;26644170500;","Improving DWT-RNN model via B-spline wavelet multiresolution to forecast a high-frequency time series",2019,"Expert Systems with Applications","138",, 112842,"","",,,"10.1016/j.eswa.2019.112842","https://www.scopus.com/inward/record.uri?eid=2-s2.0-85069827868&doi=10.1016%2fj.eswa.2019.112842&partnerID=40&md5=c103c51089b93ec959b569f86ced47cf","Department of Mathematics, Faculty of Science, Yazd University, Yazd, Iran; Department of Mathematics, Faculty of Science, Payame Noor University, Yazd, Iran; Department of Industrial Management, Faculty of Management, University of Tehran, Tehran, Iran; Department of Computer Science, University of Calgary, Calgary, Alberta, Canada","Hajiabotorabi, Z., Department of Mathematics, Faculty of Science, Yazd University, Yazd, Iran, Department of Mathematics, Faculty of Science, Payame Noor University, Yazd, Iran; Kazemi, A., Department of Industrial Management, Faculty of Management, University of Tehran, Tehran, Iran; Samavati, F.F., Department of Computer Science, University of Calgary, Calgary, Alberta, Canada; Maalek Ghaini, F.M., Department of Mathematics, Faculty of Science, Yazd University, Yazd, Iran",Article,,Scopus,2-s2.0-85069827868
"Ładyżyński P., Żbikowski K., Gawrysiak P.","55897965200;55860046500;24337898500;","Direct marketing campaigns in retail banking with the use of deep learning and random forests",2019,"Expert Systems with Applications","134",,,"28","35",,,"10.1016/j.eswa.2019.05.020","https://www.scopus.com/inward/record.uri?eid=2-s2.0-85066271331&doi=10.1016%2fj.eswa.2019.05.020&partnerID=40&md5=e0212fdaa6eb4f7777440b61e945eb81","Faculty of Mathematics and Computer Science, Warsaw University of Technology, Koszykowa 75, Warsaw, 00-662, Poland; Institute of Computer Science, Warsaw University of Technology, Nowowiejska 15/19, Warsaw, 00-665, Poland","Ładyżyński, P., Faculty of Mathematics and Computer Science, Warsaw University of Technology, Koszykowa 75, Warsaw, 00-662, Poland; Żbikowski, K., Institute of Computer Science, Warsaw University of Technology, Nowowiejska 15/19, Warsaw, 00-665, Poland; Gawrysiak, P., Institute of Computer Science, Warsaw University of Technology, Nowowiejska 15/19, Warsaw, 00-665, Poland",Article,,Scopus,2-s2.0-85066271331
"Rodrigues F., Markou I., Pereira F.C.","36647999000;56724096100;7201689596;","Combining time-series and textual data for taxi demand prediction in event areas: A deep learning approach",2019,"Information Fusion","49",,,"120","129",,3,"10.1016/j.inffus.2018.07.007","https://www.scopus.com/inward/record.uri?eid=2-s2.0-85054192390&doi=10.1016%2fj.inffus.2018.07.007&partnerID=40&md5=1c6a547ca8cff51e1d8151180dfa36fb","Technical University of Denmark (DTU), Bygning 116B, 2800 Kgs, Lyngby, Denmark","Rodrigues, F., Technical University of Denmark (DTU), Bygning 116B, 2800 Kgs, Lyngby, Denmark; Markou, I., Technical University of Denmark (DTU), Bygning 116B, 2800 Kgs, Lyngby, Denmark; Pereira, F.C., Technical University of Denmark (DTU), Bygning 116B, 2800 Kgs, Lyngby, Denmark",Article,,Scopus,2-s2.0-85054192390
"Cao J., Wang J.","57207830408;57207828548;","Stock price forecasting model based on modified convolution neural network and financial time series analysis",2019,"International Journal of Communication Systems","32","12", e3987,"","",,,"10.1002/dac.3987","https://www.scopus.com/inward/record.uri?eid=2-s2.0-85066486217&doi=10.1002%2fdac.3987&partnerID=40&md5=d02dd09dbe6500c17e643707d6789828","University of Science and Technology of China, Hefei, China; Illinois Institute of Technology, Chicago, IL, United States","Cao, J., University of Science and Technology of China, Hefei, China; Wang, J., Illinois Institute of Technology, Chicago, IL, United States",Article,,Scopus,2-s2.0-85066486217
"Xing F.Z., Cambria E., Zhang Y.","57196019442;56140547500;56462264800;","Sentiment-aware volatility forecasting",2019,"Knowledge-Based Systems","176",,,"68","76",,3,"10.1016/j.knosys.2019.03.029","https://www.scopus.com/inward/record.uri?eid=2-s2.0-85063733190&doi=10.1016%2fj.knosys.2019.03.029&partnerID=40&md5=76fd451e919da1400fbff4fcdb82e3cb","School of Computer Science & Engineering, Nanyang Technological University, Singapore; Institute of Advanced Technology, Westlake University, China","Xing, F.Z., School of Computer Science & Engineering, Nanyang Technological University, Singapore; Cambria, E., School of Computer Science & Engineering, Nanyang Technological University, Singapore; Zhang, Y., Institute of Advanced Technology, Westlake University, China",Article,,Scopus,2-s2.0-85063733190
"Zhang Z., Zohren S., Roberts S.","57208652822;14057447500;57203276441;","DeepLOB: Deep convolutional neural networks for limit order books",2019,"IEEE Transactions on Signal Processing","67","11", 8673598,"3001","3012",,,"10.1109/TSP.2019.2907260","https://www.scopus.com/inward/record.uri?eid=2-s2.0-85065427368&doi=10.1109%2fTSP.2019.2907260&partnerID=40&md5=f958ee05acc0f4d49c2232aef3c4fda0","Oxford-Man Institute of Quantitative Finance, Department of Engineering Science, University of Oxford, Oxford, OX1 2JD, United Kingdom","Zhang, Z., Oxford-Man Institute of Quantitative Finance, Department of Engineering Science, University of Oxford, Oxford, OX1 2JD, United Kingdom; Zohren, S., Oxford-Man Institute of Quantitative Finance, Department of Engineering Science, University of Oxford, Oxford, OX1 2JD, United Kingdom; Roberts, S., Oxford-Man Institute of Quantitative Finance, Department of Engineering Science, University of Oxford, Oxford, OX1 2JD, United Kingdom",Article,,Scopus,2-s2.0-85065427368
"Shi L., Teng Z., Wang L., Zhang Y., Binder A.","55520303300;57191849336;57189032831;57202890579;7103335240;","DeepClue: Visual interpretation of text-based deep stock prediction",2019,"IEEE Transactions on Knowledge and Data Engineering","31","6", 8408524,"1094","1108",,1,"10.1109/TKDE.2018.2854193","https://www.scopus.com/inward/record.uri?eid=2-s2.0-85049670640&doi=10.1109%2fTKDE.2018.2854193&partnerID=40&md5=533b3ce311e3efbb3cffe99494caf059","SKLCS, Institute of Software, Chinese Academy of Sciences, Beijing, 100864, China; University of Chinese Academy of Sciences (UCAS), Beijing, 100049, China; Singapore University of Technology Design, Singapore, 487372, Singapore","Shi, L., SKLCS, Institute of Software, Chinese Academy of Sciences, Beijing, 100864, China, University of Chinese Academy of Sciences (UCAS), Beijing, 100049, China; Teng, Z., Singapore University of Technology Design, Singapore, 487372, Singapore; Wang, L., SKLCS, Institute of Software, Chinese Academy of Sciences, Beijing, 100864, China, University of Chinese Academy of Sciences (UCAS), Beijing, 100049, China; Zhang, Y., Singapore University of Technology Design, Singapore, 487372, Singapore; Binder, A., Singapore University of Technology Design, Singapore, 487372, Singapore",Article,,Scopus,2-s2.0-85049670640
"Yeze Z., Yiying W.","57209140407;57209134544;","Stock Price Prediction Based on Information Entropy and Artificial Neural Network",2019,"5th International Conference on Information Management, ICIM 2019",,, 8714662,"248","251",,,"10.1109/INFOMAN.2019.8714662","https://www.scopus.com/inward/record.uri?eid=2-s2.0-85066631662&doi=10.1109%2fINFOMAN.2019.8714662&partnerID=40&md5=e8aeb6d2dd566309691021b20213eb21","School of Computer and Information Technology, Beijing Jiaotong University, Beijing, China; Department of Mathematics, University of Liverpool, Liverpool, United Kingdom","Yeze, Z., School of Computer and Information Technology, Beijing Jiaotong University, Beijing, China; Yiying, W., Department of Mathematics, University of Liverpool, Liverpool, United Kingdom",Conference Paper,,Scopus,2-s2.0-85066631662
"Passalis N., Tefas A., Kanniainen J., Gabbouj M., Iosifidis A.","56897101400;6701672908;23394868200;7005332419;36720841400;","Deep Temporal Logistic Bag-of-features for Forecasting High Frequency Limit Order Book Time Series",2019,"ICASSP, IEEE International Conference on Acoustics, Speech and Signal Processing - Proceedings","2019-May",, 8682297,"7545","7549",,,"10.1109/ICASSP.2019.8682297","https://www.scopus.com/inward/record.uri?eid=2-s2.0-85069000578&doi=10.1109%2fICASSP.2019.8682297&partnerID=40&md5=2d843d9f98f084beab64a4d27a28ad0f","School of Informatics, Aristotle University of Thessaloniki, Greece; Faculty of Information Technology and Communication Sciences, Tampere University, Finland; Dept. of Engineering, Aarhus University, Denmark","Passalis, N., School of Informatics, Aristotle University of Thessaloniki, Greece, Faculty of Information Technology and Communication Sciences, Tampere University, Finland; Tefas, A., School of Informatics, Aristotle University of Thessaloniki, Greece; Kanniainen, J., Faculty of Information Technology and Communication Sciences, Tampere University, Finland; Gabbouj, M., Faculty of Information Technology and Communication Sciences, Tampere University, Finland; Iosifidis, A., Dept. of Engineering, Aarhus University, Denmark",Conference Paper,,Scopus,2-s2.0-85069000578
"Karmiani D., Kazi R., Nambisan A., Shah A., Kamble V.","57208722670;57208718984;57208719870;57208721548;56919409700;","Comparison of Predictive Algorithms: Backpropagation, SVM, LSTM and Kalman Filter for Stock Market",2019,"Proceedings - 2019 Amity International Conference on Artificial Intelligence, AICAI 2019",,, 8701258,"228","234",,,"10.1109/AICAI.2019.8701258","https://www.scopus.com/inward/record.uri?eid=2-s2.0-85065601062&doi=10.1109%2fAICAI.2019.8701258&partnerID=40&md5=836d28838447606093d59d292d5a863a","Sardar Patel Institute of Technology, Mumbai, India","Karmiani, D., Sardar Patel Institute of Technology, Mumbai, India; Kazi, R., Sardar Patel Institute of Technology, Mumbai, India; Nambisan, A., Sardar Patel Institute of Technology, Mumbai, India; Shah, A., Sardar Patel Institute of Technology, Mumbai, India; Kamble, V., Sardar Patel Institute of Technology, Mumbai, India",Conference Paper,,Scopus,2-s2.0-85065601062
"Wang B., Wang J.","57205691331;55946707000;","Energy futures prices forecasting by novel DPFWR neural network and DS-CID evaluation",2019,"Neurocomputing","338",,,"1","15",,,"10.1016/j.neucom.2019.01.092","https://www.scopus.com/inward/record.uri?eid=2-s2.0-85061162689&doi=10.1016%2fj.neucom.2019.01.092&partnerID=40&md5=17a6773bf1cac120eb3a6d95d37ad7f2","School of Science, Beijing Jiaotong University, Beijing, 100044, China","Wang, B., School of Science, Beijing Jiaotong University, Beijing, 100044, China; Wang, J., School of Science, Beijing Jiaotong University, Beijing, 100044, China",Article,,Scopus,2-s2.0-85061162689
"Moews B., Herrmann J.M., Ibikunle G.","57204789588;16412284700;55509976400;","Lagged correlation-based deep learning for directional trend change prediction in financial time series",2019,"Expert Systems with Applications","120",,,"197","206",,1,"10.1016/j.eswa.2018.11.027","https://www.scopus.com/inward/record.uri?eid=2-s2.0-85057188554&doi=10.1016%2fj.eswa.2018.11.027&partnerID=40&md5=5b0f6d3076cb618d8edf95b8ffef8e62","School of Physics & Astronomy, University of Edinburgh, Edinburgh, EH9 3HJ, United Kingdom; School of Informatics, University of Edinburgh, Edinburgh, EH8 9AB, United Kingdom; Business School, University of Edinburgh, Edinburgh, EH8 9JS, United Kingdom","Moews, B., School of Physics & Astronomy, University of Edinburgh, Edinburgh, EH9 3HJ, United Kingdom; Herrmann, J.M., School of Informatics, University of Edinburgh, Edinburgh, EH8 9AB, United Kingdom; Ibikunle, G., Business School, University of Edinburgh, Edinburgh, EH8 9JS, United Kingdom",Article,,Scopus,2-s2.0-85057188554
"Sismanoglu G., Onde M.A., Kocer F., Sahingoz O.K.","57209730058;57209731841;57209734258;14054797000;","Deep learning based forecasting in stock market with big data analytics",2019,"2019 Scientific Meeting on Electrical-Electronics and Biomedical Engineering and Computer Science, EBBT 2019",,, 8741818,"","",,,"10.1109/EBBT.2019.8741818","https://www.scopus.com/inward/record.uri?eid=2-s2.0-85068552387&doi=10.1109%2fEBBT.2019.8741818&partnerID=40&md5=5bd120d0c934452e0fc6a6521877b323","Computer Engineering Department, Istanbul Kultur University, Istanbul, 34158, Turkey","Sismanoglu, G., Computer Engineering Department, Istanbul Kultur University, Istanbul, 34158, Turkey; Onde, M.A., Computer Engineering Department, Istanbul Kultur University, Istanbul, 34158, Turkey; Kocer, F., Computer Engineering Department, Istanbul Kultur University, Istanbul, 34158, Turkey; Sahingoz, O.K., Computer Engineering Department, Istanbul Kultur University, Istanbul, 34158, Turkey",Conference Paper,,Scopus,2-s2.0-85068552387
"Yan X., Zhao J.","50562404800;57206579718;","Application of improved convolution neural network in financial forecasting",2019,"2019 IEEE 4th International Conference on Cloud Computing and Big Data Analytics, ICCCBDA 2019",,, 8725661,"321","326",,,"10.1109/ICCCBDA.2019.8725661","https://www.scopus.com/inward/record.uri?eid=2-s2.0-85067471318&doi=10.1109%2fICCCBDA.2019.8725661&partnerID=40&md5=f66b4db2f9cc552158b4f6de0c7b8551","Foreign Trade College, Chongqing Normal University, NO.9 Xuefu Road, Hechuan District Chongqing, China","Yan, X., Foreign Trade College, Chongqing Normal University, NO.9 Xuefu Road, Hechuan District Chongqing, China; Zhao, J., Foreign Trade College, Chongqing Normal University, NO.9 Xuefu Road, Hechuan District Chongqing, China",Conference Paper,,Scopus,2-s2.0-85067471318
"Yu M.-H., Wu J.-L.","57208408426;36816648000;","CEAM: A Novel Approach Using Cycle Embeddings with Attention Mechanism for Stock Price Prediction",2019,"2019 IEEE International Conference on Big Data and Smart Computing, BigComp 2019 - Proceedings",,, 8679218,"","",,,"10.1109/BIGCOMP.2019.8679218","https://www.scopus.com/inward/record.uri?eid=2-s2.0-85064682040&doi=10.1109%2fBIGCOMP.2019.8679218&partnerID=40&md5=ac3380240e6e59ec5d26054649bb4bc8","Departement of Computer Sicence and Information Engineering, National Taiwan University, Taipei, Taiwan; School of Big Data Management, Soochow University, Taipei, Taiwan","Yu, M.-H., Departement of Computer Sicence and Information Engineering, National Taiwan University, Taipei, Taiwan; Wu, J.-L., School of Big Data Management, Soochow University, Taipei, Taiwan",Conference Paper,,Scopus,2-s2.0-85064682040
"Du J., Liu Q., Chen K., Wang J.","15060001900;57209464952;57209470539;57209477365;","Forecasting stock prices in two ways based on LSTM neural network",2019,"Proceedings of 2019 IEEE 3rd Information Technology, Networking, Electronic and Automation Control Conference, ITNEC 2019",,, 8729026,"1083","1086",,,"10.1109/ITNEC.2019.8729026","https://www.scopus.com/inward/record.uri?eid=2-s2.0-85067881822&doi=10.1109%2fITNEC.2019.8729026&partnerID=40&md5=3475c0bef2942f7eda91baa4ee576277","College of Electrical and Control Engineering, Xi'An University of Science and Technology, Xi'an, China","Du, J., College of Electrical and Control Engineering, Xi'An University of Science and Technology, Xi'an, China; Liu, Q., College of Electrical and Control Engineering, Xi'An University of Science and Technology, Xi'an, China; Chen, K., College of Electrical and Control Engineering, Xi'An University of Science and Technology, Xi'an, China; Wang, J., College of Electrical and Control Engineering, Xi'An University of Science and Technology, Xi'an, China",Conference Paper,,Scopus,2-s2.0-85067881822
"Thipprachak K., Tangamchit P.","57207926780;6506821304;","Spatio-temporal Model for Limit Order Books in the Stock Exchange of Thailand",2019,"2019 1st International Symposium on Instrumentation, Control, Artificial Intelligence, and Robotics, ICA-SYMP 2019",,, 8645980,"119","122",,,"10.1109/ICA-SYMP.2019.8645980","https://www.scopus.com/inward/record.uri?eid=2-s2.0-85063296627&doi=10.1109%2fICA-SYMP.2019.8645980&partnerID=40&md5=6d0d55814771a4a69014332f019d5392","Department of Control System and Instrumentation Engineering, King Mongkut's University of Technology Thonburi, 254 Phayathai Road, Pathumwan, Bangkok, Thailand","Thipprachak, K., Department of Control System and Instrumentation Engineering, King Mongkut's University of Technology Thonburi, 254 Phayathai Road, Pathumwan, Bangkok, Thailand; Tangamchit, P., Department of Control System and Instrumentation Engineering, King Mongkut's University of Technology Thonburi, 254 Phayathai Road, Pathumwan, Bangkok, Thailand",Conference Paper,,Scopus,2-s2.0-85063296627
"Wu C.-H., Lu C.-C., Ma Y.-F., Lu R.-S.","55713072400;57207760751;57207762684;7402969813;","A new forecasting framework for bitcoin price with LSTM",2019,"IEEE International Conference on Data Mining Workshops, ICDMW","2018-November",, 8637486,"168","175",,1,"10.1109/ICDMW.2018.00032","https://www.scopus.com/inward/record.uri?eid=2-s2.0-85062887338&doi=10.1109%2fICDMW.2018.00032&partnerID=40&md5=24fda9f037e89099768764af286a5549","Department of Digital Content and Technology, National Taichung University of Education, Taipei, Taiwan; Department of Business Administration, St. John's University, Taipei, Taiwan; Department of International Business, National Taipei University of Business, Taipei, Taiwan; Department of Management Information Systems, Takming University of Science and Technology, Taipei, Taiwan","Wu, C.-H., Department of Digital Content and Technology, National Taichung University of Education, Taipei, Taiwan; Lu, C.-C., Department of International Business, National Taipei University of Business, Taipei, Taiwan; Ma, Y.-F., Department of Business Administration, St. John's University, Taipei, Taiwan; Lu, R.-S., Department of Management Information Systems, Takming University of Science and Technology, Taipei, Taiwan",Conference Paper,,Scopus,2-s2.0-85062887338
"Borovykh A., Bohte S., Oosterlee C.W.","57193126885;55893905100;6701797256;","Dilated convolutional neural networks for time series forecasting",2019,"Journal of Computational Finance","22","4",,"73","101",,1,"10.21314/JCF.2018.358","https://www.scopus.com/inward/record.uri?eid=2-s2.0-85065197924&doi=10.21314%2fJCF.2018.358&partnerID=40&md5=5221681d4dc69884c3c16523563360d0","Dipartimento di Matematica, Università di Bologna, Piazza di Porta San Donata, 5, Bologna, 40126, Italy; Centrum Wiskunde & Informatica, Science Park 123, Amsterdam, 1098 XG, Netherlands; Delft University of Technology, Van Mourik Broekmanweg 6, Delft, 2628 XE, Netherlands","Borovykh, A., Dipartimento di Matematica, Università di Bologna, Piazza di Porta San Donata, 5, Bologna, 40126, Italy; Bohte, S., Centrum Wiskunde & Informatica, Science Park 123, Amsterdam, 1098 XG, Netherlands; Oosterlee, C.W., Centrum Wiskunde & Informatica, Science Park 123, Amsterdam, 1098 XG, Netherlands, Delft University of Technology, Van Mourik Broekmanweg 6, Delft, 2628 XE, Netherlands",Article,,Scopus,2-s2.0-85065197924
"Huang H.-S., Liu C.-L., Tseng V.S.","57196051044;57129735000;6507335623;","Multivariate time series early classification using multi-domain deep neural network",2019,"Proceedings - 2018 IEEE 5th International Conference on Data Science and Advanced Analytics, DSAA 2018",,, 8631422,"90","98",,1,"10.1109/DSAA.2018.00019","https://www.scopus.com/inward/record.uri?eid=2-s2.0-85062878628&doi=10.1109%2fDSAA.2018.00019&partnerID=40&md5=a25e4feb317842406639a984e19658b5","National Chiao Tung University, Hsinchu, Taiwan","Huang, H.-S., National Chiao Tung University, Hsinchu, Taiwan; Liu, C.-L., National Chiao Tung University, Hsinchu, Taiwan; Tseng, V.S., National Chiao Tung University, Hsinchu, Taiwan",Conference Paper,,Scopus,2-s2.0-85062878628
"Hossain M.A., Karim R., Thulasiram R., Bruce N.D.B., Wang Y.","57207728673;55407386600;6602683636;8347469300;56112468400;","Hybrid Deep Learning Model for Stock Price Prediction",2019,"Proceedings of the 2018 IEEE Symposium Series on Computational Intelligence, SSCI 2018",,, 8628641,"1837","1844",,1,"10.1109/SSCI.2018.8628641","https://www.scopus.com/inward/record.uri?eid=2-s2.0-85062770567&doi=10.1109%2fSSCI.2018.8628641&partnerID=40&md5=fdc0a42330e81f4f3be46ec78b64d595","Department of Computer Science, University of Manitoba, Winnipeg, Canada","Hossain, M.A., Department of Computer Science, University of Manitoba, Winnipeg, Canada; Karim, R., Department of Computer Science, University of Manitoba, Winnipeg, Canada; Thulasiram, R., Department of Computer Science, University of Manitoba, Winnipeg, Canada; Bruce, N.D.B., Department of Computer Science, University of Manitoba, Winnipeg, Canada; Wang, Y., Department of Computer Science, University of Manitoba, Winnipeg, Canada",Conference Paper,,Scopus,2-s2.0-85062770567
"Uygun Y., Erboy M.O., Aktas M.S., Kalipsiz O., Aykurt I.","57207696480;57190650159;8410237700;13408912900;57207684506;","Technical Analysis on Financial Time Series Data Based on Map-Reduce Programming Model: A Case Study [Eşle-Indirge Programlama Modeline Dayali Olarak Finansal Zaman Serisi Verileri Üzerinde Teknik Analiz: Durum Çalişmasi]",2019,"International Congress on Big Data, Deep Learning and Fighting Cyber Terrorism, IBIGDELFT 2018 - Proceedings",,, 8625357,"92","97",,,"10.1109/IBIGDELFT.2018.8625357","https://www.scopus.com/inward/record.uri?eid=2-s2.0-85062733197&doi=10.1109%2fIBIGDELFT.2018.8625357&partnerID=40&md5=4e8d5d6a02ffc9af758c900dc71f62f2","Bilgisayar Mühendisliǧi Bölümü, Yildiz Teknik Üniversitesi, Istanbul, Esenler, Turkey; YTü-Teknopark, Finnet-Elektronik, Istanbul, Esenler, Turkey","Uygun, Y., Bilgisayar Mühendisliǧi Bölümü, Yildiz Teknik Üniversitesi, Istanbul, Esenler, Turkey; Erboy, M.O., Bilgisayar Mühendisliǧi Bölümü, Yildiz Teknik Üniversitesi, Istanbul, Esenler, Turkey; Aktas, M.S., Bilgisayar Mühendisliǧi Bölümü, Yildiz Teknik Üniversitesi, Istanbul, Esenler, Turkey; Kalipsiz, O., Bilgisayar Mühendisliǧi Bölümü, Yildiz Teknik Üniversitesi, Istanbul, Esenler, Turkey; Aykurt, I., YTü-Teknopark, Finnet-Elektronik, Istanbul, Esenler, Turkey",Conference Paper,,Scopus,2-s2.0-85062733197
"Islam S.R., Khaled Ghafoor S., Eberle W.","57195922078;57207579157;24558789000;","Mining Illegal Insider Trading of Stocks: A Proactive Approach",2019,"Proceedings - 2018 IEEE International Conference on Big Data, Big Data 2018",,, 8622303,"1397","1406",,,"10.1109/BigData.2018.8622303","https://www.scopus.com/inward/record.uri?eid=2-s2.0-85062622552&doi=10.1109%2fBigData.2018.8622303&partnerID=40&md5=ea981bbf9fefb64b711a779d7e53db33","Computer Science, Tennessee Technological University, Cookeville, United States","Islam, S.R., Computer Science, Tennessee Technological University, Cookeville, United States; Khaled Ghafoor, S., Computer Science, Tennessee Technological University, Cookeville, United States; Eberle, W., Computer Science, Tennessee Technological University, Cookeville, United States",Conference Paper,,Scopus,2-s2.0-85062622552
"Siami-Namini S., Tavakoli N., Siami Namin A.","57201302278;57198291892;36171214700;","A Comparison of ARIMA and LSTM in Forecasting Time Series",2019,"Proceedings - 17th IEEE International Conference on Machine Learning and Applications, ICMLA 2018",,, 8614252,"1394","1401",,1,"10.1109/ICMLA.2018.00227","https://www.scopus.com/inward/record.uri?eid=2-s2.0-85062240139&doi=10.1109%2fICMLA.2018.00227&partnerID=40&md5=cd3c7fb3c393f6e2bd5e8de7c43b2422","Department of Applied Economics, Texas Tech University, United States; Department of Computer Science, Georgia Institute of Technology, United States","Siami-Namini, S., Department of Applied Economics, Texas Tech University, United States; Tavakoli, N., Department of Computer Science, Georgia Institute of Technology, United States; Siami Namin, A., Department of Applied Economics, Texas Tech University, United States",Conference Paper,,Scopus,2-s2.0-85062240139
"Morris K.J., Egan S.D., Linsangan J.L., Leung C.K., Cuzzocrea A., Hoi C.S.H.","57198863686;57207108540;57207114198;7402612526;23388216900;57202789966;","Token-Based Adaptive Time-Series Prediction by Ensembling Linear and Non-linear Estimators: A Machine Learning Approach for Predictive Analytics on big Stock Data",2019,"Proceedings - 17th IEEE International Conference on Machine Learning and Applications, ICMLA 2018",,, 8614267,"1486","1491",,1,"10.1109/ICMLA.2018.00242","https://www.scopus.com/inward/record.uri?eid=2-s2.0-85062213716&doi=10.1109%2fICMLA.2018.00242&partnerID=40&md5=4f5b54b41303692eefecc50b383449c3","University of Manitoba, Winnipeg, MB, Canada; University of Trieste, Trieste, Italy","Morris, K.J., University of Manitoba, Winnipeg, MB, Canada; Egan, S.D., University of Manitoba, Winnipeg, MB, Canada; Linsangan, J.L., University of Manitoba, Winnipeg, MB, Canada; Leung, C.K., University of Manitoba, Winnipeg, MB, Canada; Cuzzocrea, A., University of Trieste, Trieste, Italy; Hoi, C.S.H., University of Manitoba, Winnipeg, MB, Canada",Conference Paper,,Scopus,2-s2.0-85062213716
