Authors,Author(s) ID,Title,Year,Source title,Volume,Issue,Art. No.,Page start,Page end,Page count,Cited by,DOI,Link,Affiliations,Authors with affiliations,Document Type,Access Type,Source,EID
"Long W., Lu Z., Cui L.","36792418900;57207322594;57189992988;","Deep learning-based feature engineering for stock price movement prediction",2019,"Knowledge-Based Systems","164",,,"163","173",,5,"10.1016/j.knosys.2018.10.034","https://www.scopus.com/inward/record.uri?eid=2-s2.0-85057856973&doi=10.1016%2fj.knosys.2018.10.034&partnerID=40&md5=b73efaf564b39e115a46668f16caa1ec","School of Economics & Management, University of Chinese Academy of Sciences, Beijing, 100190, PR China; Research Center on Fictitious Economy & Data Science, Chinese Academy of Sciences, Beijing, 100190, PR China; Key Laboratory of Big Data Mining & Knowledge Management, Chinese Academy of Sciences, Beijing, 100190, PR China","Long, W., School of Economics & Management, University of Chinese Academy of Sciences, Beijing, 100190, PR China; Research Center on Fictitious Economy & Data Science, Chinese Academy of Sciences, Beijing, 100190, PR China; Key Laboratory of Big Data Mining & Knowledge Management, Chinese Academy of Sciences, Beijing, 100190, PR China; Lu, Z., School of Economics & Management, University of Chinese Academy of Sciences, Beijing, 100190, PR China; Research Center on Fictitious Economy & Data Science, Chinese Academy of Sciences, Beijing, 100190, PR China; Key Laboratory of Big Data Mining & Knowledge Management, Chinese Academy of Sciences, Beijing, 100190, PR China; Cui, L., School of Economics & Management, University of Chinese Academy of Sciences, Beijing, 100190, PR China; Research Center on Fictitious Economy & Data Science, Chinese Academy of Sciences, Beijing, 100190, PR China; Key Laboratory of Big Data Mining & Knowledge Management, Chinese Academy of Sciences, Beijing, 100190, PR China",Article,,Scopus,2-s2.0-85057856973
"Le L., Xie Y.","57193344346;55710281400;","Recurrent Embedding Kernel for Predicting Stock Daily Direction",2019,"Proceedings - 5th IEEE/ACM International Conference on Big Data Computing, Applications and Technologies, BDCAT 2018",,, 8606647,"160","166",,,"10.1109/BDCAT.2018.00027","https://www.scopus.com/inward/record.uri?eid=2-s2.0-85061796761&doi=10.1109%2fBDCAT.2018.00027&partnerID=40&md5=1f323dd13e4d4d0eb2827061d4c08c90","Institute of Analytics and Data Science, Kennesaw State University, Kennesaw, GA, United States; Department of Information Technology, Kennesaw State University, Kennesaw, GA, United States","Le, L., Institute of Analytics and Data Science, Kennesaw State University, Kennesaw, GA, United States; Xie, Y., Department of Information Technology, Kennesaw State University, Kennesaw, GA, United States",Conference Paper,,Scopus,2-s2.0-85061796761
"Zheng J., Fu X., Zhang G.","44062068800;57005856100;56949237700;","Research on exchange rate forecasting based on deep belief network",2019,"Neural Computing and Applications","31",,,"573","582",,3,"10.1007/s00521-017-3039-z","https://www.scopus.com/inward/record.uri?eid=2-s2.0-85019084658&doi=10.1007%2fs00521-017-3039-z&partnerID=40&md5=3b037a968321059479bfa0a781cdc4a9","College of Economics, Hangzhou Dianzi University, Hangzhou, 310018, China; Institute of Innovation and Development, Hangzhou Dianzi University, Hangzhou, 310018, China; Institute of Applied Mathematics, Hangzhou Dianzi University, Hangzhou, 310018, China","Zheng, J., College of Economics, Hangzhou Dianzi University, Hangzhou, 310018, China; Fu, X., Institute of Innovation and Development, Hangzhou Dianzi University, Hangzhou, 310018, China; Zhang, G., Institute of Applied Mathematics, Hangzhou Dianzi University, Hangzhou, 310018, China",Article,,Scopus,2-s2.0-85019084658
"Yasir M., Durrani M.Y., Afzal S., Maqsood M., Aadil F., Mehmood I., Rho S.","35231560800;24775626200;57210197386;57197810097;53983838100;36628922400;10738984000;","An intelligent event-sentiment-based daily foreign exchange rate forecasting system",2019,"Applied Sciences (Switzerland)","9","15", 2980,"","",,,"10.3390/app9152980","https://www.scopus.com/inward/record.uri?eid=2-s2.0-85070561213&doi=10.3390%2fapp9152980&partnerID=40&md5=a3a82c448fac752236218cf90c165e0b","Department of Management Sciences, COMSATS University Islamabad, Attock Campus, Attock, 43600, Pakistan; Department of Computer Science, COMSATS University Islamabad, Attock Campus, Attock, 43600, Pakistan; Department of Media Design and Technology, Faculty of Engineering and Informatics, University of Bradford, Bradford, BD7 1DP, United Kingdom; Department of Software, Sejong University, Seoul, 05006, South Korea","Yasir, M., Department of Management Sciences, COMSATS University Islamabad, Attock Campus, Attock, 43600, Pakistan; Durrani, M.Y., Department of Computer Science, COMSATS University Islamabad, Attock Campus, Attock, 43600, Pakistan; Afzal, S., Department of Computer Science, COMSATS University Islamabad, Attock Campus, Attock, 43600, Pakistan; Maqsood, M., Department of Computer Science, COMSATS University Islamabad, Attock Campus, Attock, 43600, Pakistan; Aadil, F., Department of Computer Science, COMSATS University Islamabad, Attock Campus, Attock, 43600, Pakistan; Mehmood, I., Department of Media Design and Technology, Faculty of Engineering and Informatics, University of Bradford, Bradford, BD7 1DP, United Kingdom; Rho, S., Department of Software, Sejong University, Seoul, 05006, South Korea",Article,Open Access,Scopus,2-s2.0-85070561213
"Zhang C., Dai Q., Song G.","56072612200;35315440400;57104239400;","DeepCascade-WR: a cascading deep architecture based on weak results for time series prediction",2019,"International Journal of Machine Learning and Cybernetics",,,,"","",,,"10.1007/s13042-019-00994-7","https://www.scopus.com/inward/record.uri?eid=2-s2.0-85070276611&doi=10.1007%2fs13042-019-00994-7&partnerID=40&md5=bd9e3773c00442234b69465ef431719d","College of Computer Science and Technology, Nanjing University of Aeronautics and Astronautics, Nanjing, 211106, China","Zhang, C., College of Computer Science and Technology, Nanjing University of Aeronautics and Astronautics, Nanjing, 211106, China; Dai, Q., College of Computer Science and Technology, Nanjing University of Aeronautics and Astronautics, Nanjing, 211106, China; Song, G., College of Computer Science and Technology, Nanjing University of Aeronautics and Astronautics, Nanjing, 211106, China",Article,,Scopus,2-s2.0-85070276611
"Moro G., Pasolini R., Domeniconi G., Ghini V.","8702087400;56412031400;56411905800;6507031598;","Deep Neural Trading: Comparative Study with Feed Forward, Recurrent and Autoencoder Networks",2019,"Communications in Computer and Information Science","862",,,"189","209",,,"10.1007/978-3-030-26636-3_9","https://www.scopus.com/inward/record.uri?eid=2-s2.0-85070196844&doi=10.1007%2f978-3-030-26636-3_9&partnerID=40&md5=a8f6aba9db12e6a044fd9a932d5da4b5","Department of Computer Science and Engineering, University of Bologna, Via dell’Università, 50, Cesena, 47522, Italy; IBM TJ Watson Research Center, 1101 Kitchawan Road, Yorktown Heights, NY  10598, United States","Moro, G., Department of Computer Science and Engineering, University of Bologna, Via dell’Università, 50, Cesena, 47522, Italy; Pasolini, R., Department of Computer Science and Engineering, University of Bologna, Via dell’Università, 50, Cesena, 47522, Italy; Domeniconi, G., IBM TJ Watson Research Center, 1101 Kitchawan Road, Yorktown Heights, NY  10598, United States; Ghini, V., Department of Computer Science and Engineering, University of Bologna, Via dell’Università, 50, Cesena, 47522, Italy",Conference Paper,,Scopus,2-s2.0-85070196844
"Weytjens H., Lohmann E., Kleinsteuber M.","37071509600;57195594980;8257006600;","Cash flow prediction: MLP and LSTM compared to ARIMA and Prophet",2019,"Electronic Commerce Research",,,,"","",,,"10.1007/s10660-019-09362-7","https://www.scopus.com/inward/record.uri?eid=2-s2.0-85069515246&doi=10.1007%2fs10660-019-09362-7&partnerID=40&md5=a6413203ef4a7417fe2b94eb4955f83b","Gruenwald, Germany; Mercateo AG, Munich, Germany; Technische Universität München (TUM), Munich, Germany","Weytjens, H., Gruenwald, Germany; Lohmann, E., Mercateo AG, Munich, Germany; Kleinsteuber, M., Mercateo AG, Munich, Germany, Technische Universität München (TUM), Munich, Germany",Article,,Scopus,2-s2.0-85069515246
"Liashenko O., Kravets T.","57210112572;14063413700;","The relationship between oil and gas prices, dow jones and US dollar indexes: A wavelet co-movement estimation and neural network forecasting",2019,"CEUR Workshop Proceedings","2393",,,"348","363",,,,"https://www.scopus.com/inward/record.uri?eid=2-s2.0-85069440052&partnerID=40&md5=3ddb022f37168a348e54458dd8a1b5e1","Taras Shevchenko National University of Kyiv, Ukraine","Liashenko, O., Taras Shevchenko National University of Kyiv, Ukraine; Kravets, T., Taras Shevchenko National University of Kyiv, Ukraine",Conference Paper,,Scopus,2-s2.0-85069440052
"Lee R.S.T.","57209821688;","Chaotic Interval Type-2 Fuzzy Neuro-oscillatory Network (CIT2-FNON) for Worldwide 129 Financial Products Prediction",2019,"International Journal of Fuzzy Systems",,,,"","",,,"10.1007/s40815-019-00688-w","https://www.scopus.com/inward/record.uri?eid=2-s2.0-85068864101&doi=10.1007%2fs40815-019-00688-w&partnerID=40&md5=8f5f8ccb9b79884eb302469df9eb3eba","Division of Science and Technology, BNU-HKBU United International College, Zhuhai, Guangdong, China","Lee, R.S.T., Division of Science and Technology, BNU-HKBU United International College, Zhuhai, Guangdong, China",Article,,Scopus,2-s2.0-85068864101
"Fu X., Zhang S., Chen J., Ouyang T., Wu J.","36614138900;57203165289;55925522600;57209774396;55714034400;","A Sentiment-Aware Trading Volume Prediction Model for P2P Market Using LSTM",2019,"IEEE Access","7",, 8740855,"81934","81944",,,"10.1109/ACCESS.2019.2923637","https://www.scopus.com/inward/record.uri?eid=2-s2.0-85068690385&doi=10.1109%2fACCESS.2019.2923637&partnerID=40&md5=063127014f7880a9179a08356bd7f0c2","School of Software Engineering, Beijing University of Posts and Telecommunications, Beijing, 100876, China; Department of Electronic Engineering, Tsinghua University, Beijing, 100084, China; Key Laboratory of Trustworthy Distributed Computing and Service, Ministry of Education, Beijing University of Posts and Telecommunications, Beijing, 100876, China","Fu, X., School of Software Engineering, Beijing University of Posts and Telecommunications, Beijing, 100876, China, Key Laboratory of Trustworthy Distributed Computing and Service, Ministry of Education, Beijing University of Posts and Telecommunications, Beijing, 100876, China; Zhang, S., School of Software Engineering, Beijing University of Posts and Telecommunications, Beijing, 100876, China, Key Laboratory of Trustworthy Distributed Computing and Service, Ministry of Education, Beijing University of Posts and Telecommunications, Beijing, 100876, China; Chen, J., School of Software Engineering, Beijing University of Posts and Telecommunications, Beijing, 100876, China; Ouyang, T., School of Software Engineering, Beijing University of Posts and Telecommunications, Beijing, 100876, China, Key Laboratory of Trustworthy Distributed Computing and Service, Ministry of Education, Beijing University of Posts and Telecommunications, Beijing, 100876, China; Wu, J., Department of Electronic Engineering, Tsinghua University, Beijing, 100084, China",Article,Open Access,Scopus,2-s2.0-85068690385
"Sirignano J., Cont R.","35753895800;6602945666;","Universal features of price formation in financial markets: perspectives from deep learning",2019,"Quantitative Finance","19","9",,"1449","1459",,,"10.1080/14697688.2019.1622295","https://www.scopus.com/inward/record.uri?eid=2-s2.0-85068677237&doi=10.1080%2f14697688.2019.1622295&partnerID=40&md5=b7aa4082d05477e65a52a513cdddf343","Industrial and Systems Engineering, University of Illinois at Urbana-Champaign, Urbana, IL, United States; Mathematical Institute, University of Oxford, Oxford, United Kingdom","Sirignano, J., Industrial and Systems Engineering, University of Illinois at Urbana-Champaign, Urbana, IL, United States; Cont, R., Mathematical Institute, University of Oxford, Oxford, United Kingdom",Article,,Scopus,2-s2.0-85068677237
"Miura R., Pichl L., Kaizoji T.","57209745684;6701314709;6603679407;","Artificial Neural Networks for Realized Volatility Prediction in Cryptocurrency Time Series",2019,"Lecture Notes in Computer Science (including subseries Lecture Notes in Artificial Intelligence and Lecture Notes in Bioinformatics)","11554 LNCS",,,"165","172",,,"10.1007/978-3-030-22796-8_18","https://www.scopus.com/inward/record.uri?eid=2-s2.0-85068615399&doi=10.1007%2f978-3-030-22796-8_18&partnerID=40&md5=57e85658236fa53c446bb2537b5aad2b","International Christian University, Osawa 3-10-2, Mitaka, Tokyo  181-8585, Japan","Miura, R., International Christian University, Osawa 3-10-2, Mitaka, Tokyo  181-8585, Japan; Pichl, L., International Christian University, Osawa 3-10-2, Mitaka, Tokyo  181-8585, Japan; Kaizoji, T., International Christian University, Osawa 3-10-2, Mitaka, Tokyo  181-8585, Japan",Conference Paper,,Scopus,2-s2.0-85068615399
"Lu M.","57209638825;","A monetary policy prediction model based on deep learning",2019,"Neural Computing and Applications",,,,"","",,,"10.1007/s00521-019-04319-1","https://www.scopus.com/inward/record.uri?eid=2-s2.0-85068321387&doi=10.1007%2fs00521-019-04319-1&partnerID=40&md5=8f2af3404d9a2c6273c448fc607ad40a","School of Accounting, Fujian Jiangxia University, Fuzhou, Fujian Province  350108, China","Lu, M., School of Accounting, Fujian Jiangxia University, Fuzhou, Fujian Province  350108, China",Article,,Scopus,2-s2.0-85068321387
"Yang X., Mao S., Gao H., Duan Y., Zou Q.","57189699603;57092455700;36442463200;56328556200;57209332513;","Novel financial capital flow forecast framework using time series theory and deep learning: A case study analysis of Yu'e Bao transaction data",2019,"IEEE Access","7",, 8723033,"70662","70672",,,"10.1109/ACCESS.2019.2919189","https://www.scopus.com/inward/record.uri?eid=2-s2.0-85067398528&doi=10.1109%2fACCESS.2019.2919189&partnerID=40&md5=fd1d14081522b0376634f091a934d27a","School of Computer and Information Engineering, Shanghai Polytechnic University, Shanghai, 201209, China; Computing Center, Shanghai University, Shanghai, 200444, China; College of Information Science and Technology, Hainan University, Haikou, 570100, China; Shanghai Shangda Hairun Information System Co., Ltd., Shanghai, 200444, China","Yang, X., School of Computer and Information Engineering, Shanghai Polytechnic University, Shanghai, 201209, China; Mao, S., Computing Center, Shanghai University, Shanghai, 200444, China; Gao, H., Computing Center, Shanghai University, Shanghai, 200444, China; Duan, Y., College of Information Science and Technology, Hainan University, Haikou, 570100, China; Zou, Q., Computing Center, Shanghai University, Shanghai, 200444, China, Shanghai Shangda Hairun Information System Co., Ltd., Shanghai, 200444, China",Article,Open Access,Scopus,2-s2.0-85067398528
"Siddiqui S.A., Mercier D., Munir M., Dengel A., Ahmed S.","57200439899;57197827803;57201250579;6603764314;54410250600;","TSViz: Demystification of Deep Learning Models for Time-Series Analysis",2019,"IEEE Access","7",, 8695734,"67027","67040",,,"10.1109/ACCESS.2019.2912823","https://www.scopus.com/inward/record.uri?eid=2-s2.0-85067255101&doi=10.1109%2fACCESS.2019.2912823&partnerID=40&md5=ed76d5ab033a4740f780824051bde9fb","German Research Center for Artificial Intelligence (DFKI), Kaiserslautern, Germany; Technische Universitaet Kaiserslautern, Kaiserslautern, 67663, Germany","Siddiqui, S.A., German Research Center for Artificial Intelligence (DFKI), Kaiserslautern, Germany, Technische Universitaet Kaiserslautern, Kaiserslautern, 67663, Germany; Mercier, D., German Research Center for Artificial Intelligence (DFKI), Kaiserslautern, Germany, Technische Universitaet Kaiserslautern, Kaiserslautern, 67663, Germany; Munir, M., German Research Center for Artificial Intelligence (DFKI), Kaiserslautern, Germany, Technische Universitaet Kaiserslautern, Kaiserslautern, 67663, Germany; Dengel, A., German Research Center for Artificial Intelligence (DFKI), Kaiserslautern, Germany, Technische Universitaet Kaiserslautern, Kaiserslautern, 67663, Germany; Ahmed, S., German Research Center for Artificial Intelligence (DFKI), Kaiserslautern, Germany",Article,Open Access,Scopus,2-s2.0-85067255101
"Ni L., Li Y., Wang X., Zhang J., Yu J., Qi C.","7102681459;57201377077;57201523676;52164985200;57194244903;24081271700;","Forecasting of Forex Time Series Data Based on Deep Learning",2019,"Procedia Computer Science","147",,,"647","652",,,"10.1016/j.procs.2019.01.189","https://www.scopus.com/inward/record.uri?eid=2-s2.0-85066033657&doi=10.1016%2fj.procs.2019.01.189&partnerID=40&md5=a782fa0d1b64f2a7424f6c185b797325","College of Computer Science and Engineering, Shandong University of Science and Technology, Qingdao, 266590, China; Shandong Province Key Laboratory of Wisdom Mine Information Technology, Shandong University of Science and Technology, Qingdao, 266590, China; Key Laboratory of Embedded System and Service Computing, Ministry of Education, Tongji University, Shanghai, 200092, China; Qilu University of Technology (Shandong Academy of Sciences), Jinan Shandong, 250014, China; Shandong Computer Science Center (National Supercomputer Center in Jinan), Jinan Shandong, 250014, China; Beijing Union University, Beijing, 100101, China","Ni, L., College of Computer Science and Engineering, Shandong University of Science and Technology, Qingdao, 266590, China, Shandong Province Key Laboratory of Wisdom Mine Information Technology, Shandong University of Science and Technology, Qingdao, 266590, China, Key Laboratory of Embedded System and Service Computing, Ministry of Education, Tongji University, Shanghai, 200092, China; Li, Y., College of Computer Science and Engineering, Shandong University of Science and Technology, Qingdao, 266590, China; Wang, X., College of Computer Science and Engineering, Shandong University of Science and Technology, Qingdao, 266590, China; Zhang, J., College of Computer Science and Engineering, Shandong University of Science and Technology, Qingdao, 266590, China, Shandong Province Key Laboratory of Wisdom Mine Information Technology, Shandong University of Science and Technology, Qingdao, 266590, China; Yu, J., Qilu University of Technology (Shandong Academy of Sciences), Jinan Shandong, 250014, China, Shandong Computer Science Center (National Supercomputer Center in Jinan), Jinan Shandong, 250014, China; Qi, C., Beijing Union University, Beijing, 100101, China",Conference Paper,Open Access,Scopus,2-s2.0-85066033657
"Bhowmick A., Rahman A., Rahman R.M.","57208836861;20535568700;57202814494;","Performance analysis of different recurrent neural network architectures and classical statistical model for financial forecasting: A case study on dhaka stock exchange",2019,"Advances in Intelligent Systems and Computing","985",,,"277","286",,,"10.1007/978-3-030-19810-7_27","https://www.scopus.com/inward/record.uri?eid=2-s2.0-85065917523&doi=10.1007%2f978-3-030-19810-7_27&partnerID=40&md5=29e9d2d2190476b887ccdd0a100b5fbb","Department of Electrical and Computer Engineering, North South University, Plot-15, Block-B, Bashundhara Residential Area, Dhaka, Bangladesh","Bhowmick, A., Department of Electrical and Computer Engineering, North South University, Plot-15, Block-B, Bashundhara Residential Area, Dhaka, Bangladesh; Rahman, A., Department of Electrical and Computer Engineering, North South University, Plot-15, Block-B, Bashundhara Residential Area, Dhaka, Bangladesh; Rahman, R.M., Department of Electrical and Computer Engineering, North South University, Plot-15, Block-B, Bashundhara Residential Area, Dhaka, Bangladesh",Conference Paper,,Scopus,2-s2.0-85065917523
"Hsu E.-Y., Liu C.-L., Tseng V.S.","57208527341;57129735000;6507335623;","Multivariate time series early classification with interpretability using deep learning and attention mechanism",2019,"Lecture Notes in Computer Science (including subseries Lecture Notes in Artificial Intelligence and Lecture Notes in Bioinformatics)","11441 LNAI",,,"541","553",,,"10.1007/978-3-030-16142-2_42","https://www.scopus.com/inward/record.uri?eid=2-s2.0-85065043935&doi=10.1007%2f978-3-030-16142-2_42&partnerID=40&md5=2334a38b8ef44259449630bbc4b4d5a9","Department of Computer Science, National Chiao Tung University, 1001 University Road, Hsinchu, 300, Taiwan; Department of Industrial Engineering and Management, National Chiao Tung University, 1001 University Road, Hsinchu, 300, Taiwan","Hsu, E.-Y., Department of Computer Science, National Chiao Tung University, 1001 University Road, Hsinchu, 300, Taiwan; Liu, C.-L., Department of Industrial Engineering and Management, National Chiao Tung University, 1001 University Road, Hsinchu, 300, Taiwan; Tseng, V.S., Department of Computer Science, National Chiao Tung University, 1001 University Road, Hsinchu, 300, Taiwan",Conference Paper,,Scopus,2-s2.0-85065043935
"Au Yeung J.F.K., Wei Z.-K., Chan K.Y., Lau H.Y.K., Yiu K.-F.C.","57208441553;57200795560;55647800400;7201497761;24802813000;","Jump detection in financial time series using machine learning algorithms",2019,"Soft Computing",,,,"","",,,"10.1007/s00500-019-04006-2","https://www.scopus.com/inward/record.uri?eid=2-s2.0-85064841438&doi=10.1007%2fs00500-019-04006-2&partnerID=40&md5=2639fa521ccb02834040e5c254070614","Department of Industrial and Manufacturing Systems Engineering, The University of Hong Kong, Pokfulam, Hong Kong; Department of Applied Mathematics, The Hong Kong Polytechnic University, Hung Hom, Kowloon, Hong Kong; School of Electrical Engineering, Computing and Mathematical Sciences, Curtin University, Perth, Australia","Au Yeung, J.F.K., Department of Industrial and Manufacturing Systems Engineering, The University of Hong Kong, Pokfulam, Hong Kong; Wei, Z.-K., Department of Applied Mathematics, The Hong Kong Polytechnic University, Hung Hom, Kowloon, Hong Kong; Chan, K.Y., School of Electrical Engineering, Computing and Mathematical Sciences, Curtin University, Perth, Australia; Lau, H.Y.K., Department of Industrial and Manufacturing Systems Engineering, The University of Hong Kong, Pokfulam, Hong Kong; Yiu, K.-F.C., Department of Applied Mathematics, The Hong Kong Polytechnic University, Hung Hom, Kowloon, Hong Kong",Article,,Scopus,2-s2.0-85064841438
"Yu P., Yan X.","57208402963;23391007200;","Stock price prediction based on deep neural networks",2019,"Neural Computing and Applications",,,,"","",,,"10.1007/s00521-019-04212-x","https://www.scopus.com/inward/record.uri?eid=2-s2.0-85064689405&doi=10.1007%2fs00521-019-04212-x&partnerID=40&md5=b20c85b350e360b4d046477044b58715","School of Computer Science, China University of Geosciences, Wuhan, Hubei  430074, China; Hubei Key Laboratary of Intelligent Geo-Information Processing, Wuhan, Hubei  430074, China","Yu, P., School of Computer Science, China University of Geosciences, Wuhan, Hubei  430074, China, Hubei Key Laboratary of Intelligent Geo-Information Processing, Wuhan, Hubei  430074, China; Yan, X., School of Computer Science, China University of Geosciences, Wuhan, Hubei  430074, China, Hubei Key Laboratary of Intelligent Geo-Information Processing, Wuhan, Hubei  430074, China",Article,,Scopus,2-s2.0-85064689405
"De Stefani J., Caelen O., Hattab D., LeÂ Borgne Y.-A., Bontempi G.","57196261818;15623146800;57196257647;57207980297;6603615974;","A multivariate and multi-step ahead machine learning approach to traditional and cryptocurrencies volatility forecasting",2019,"Lecture Notes in Computer Science (including subseries Lecture Notes in Artificial Intelligence and Lecture Notes in Bioinformatics)","11054 LNAI",,,"7","22",,,"10.1007/978-3-030-13463-1_1","https://www.scopus.com/inward/record.uri?eid=2-s2.0-85063442106&doi=10.1007%2f978-3-030-13463-1_1&partnerID=40&md5=d128a5762da5086dd933593e400267c7","MLG, Departement d’Informatique, Université Libre de Bruxelles, Boulevard du Triomphe CP212, Brussels, 1050, Belgium; Worldline SA/NV R&D, Brussels, Belgium; Equens Worldline R&D, Lille, Seclin, France","De Stefani, J., MLG, Departement d’Informatique, Université Libre de Bruxelles, Boulevard du Triomphe CP212, Brussels, 1050, Belgium; Caelen, O., Worldline SA/NV R&D, Brussels, Belgium; Hattab, D., Equens Worldline R&D, Lille, Seclin, France; LeÂ Borgne, Y.-A., MLG, Departement d’Informatique, Université Libre de Bruxelles, Boulevard du Triomphe CP212, Brussels, 1050, Belgium; Bontempi, G., MLG, Departement d’Informatique, Université Libre de Bruxelles, Boulevard du Triomphe CP212, Brussels, 1050, Belgium",Conference Paper,,Scopus,2-s2.0-85063442106
"Wen M., Li P., Zhang L., Chen Y.","57207925743;57193136585;57207942564;56928458300;","Stock market trend prediction using high-order information of time series",2019,"IEEE Access","7",, 8653278,"28299","28308",,,"10.1109/ACCESS.2019.2901842","https://www.scopus.com/inward/record.uri?eid=2-s2.0-85063269215&doi=10.1109%2fACCESS.2019.2901842&partnerID=40&md5=bf89de3a4ec99b9bdbc6121c9deac89a","School of Computer Science, Southwest Petroleum University, Chengdu, 610500, China; Corporate IT Department, Nomura Securities Corporation, Tokyo, 103-8011, Japan","Wen, M., School of Computer Science, Southwest Petroleum University, Chengdu, 610500, China; Li, P., School of Computer Science, Southwest Petroleum University, Chengdu, 610500, China; Zhang, L., Corporate IT Department, Nomura Securities Corporation, Tokyo, 103-8011, Japan; Chen, Y., School of Computer Science, Southwest Petroleum University, Chengdu, 610500, China",Article,Open Access,Scopus,2-s2.0-85063269215
