Authors,Author(s) ID,Title,Year,Source title,Volume,Issue,Art. No.,Page start,Page end,Page count,Cited by,DOI,Link,Affiliations,Authors with affiliations,Document Type,Access Type,Source,EID
"Liu F., Cai M., Wang L., Lu Y.","16039764100;57207691663;54397764100;57207696983;","An Ensemble Model Based on Adaptive Noise Reducer and Over-Fitting Prevention LSTM for Multivariate Time Series Forecasting",2019,"IEEE Access","7",, 8648338,"26102","26115",,1,"10.1109/ACCESS.2019.2900371","https://www.scopus.com/inward/record.uri?eid=2-s2.0-85062693213&doi=10.1109%2fACCESS.2019.2900371&partnerID=40&md5=3fd01033ab34e1ca1f5ec93216fc950d","School of Computer Science and Engineering, South China University of Technology, Guangzhou, 510006, China; School of Software Engineering, South China University of Technology, Guangzhou, 510006, China","Liu, F., School of Computer Science and Engineering, South China University of Technology, Guangzhou, 510006, China; Cai, M., School of Computer Science and Engineering, South China University of Technology, Guangzhou, 510006, China; Wang, L., School of Software Engineering, South China University of Technology, Guangzhou, 510006, China; Lu, Y., School of Computer Science and Engineering, South China University of Technology, Guangzhou, 510006, China",Article,Open Access,Scopus,2-s2.0-85062693213
"Berradi Z., Lazaar M.","57207622928;57200595982;","Integration of Principal Component Analysis and Recurrent Neural Network to Forecast the Stock Price of Casablanca Stock Exchange",2019,"Procedia Computer Science","148",,,"55","61",,,"10.1016/j.procs.2019.01.008","https://www.scopus.com/inward/record.uri?eid=2-s2.0-85062668948&doi=10.1016%2fj.procs.2019.01.008&partnerID=40&md5=714d8f4d5e93b00d91cefffe59bfdbf8","National School of Applied Sciences, Abdelmalek Essaadi University, Tetouan, Morocco","Berradi, Z., National School of Applied Sciences, Abdelmalek Essaadi University, Tetouan, Morocco; Lazaar, M., National School of Applied Sciences, Abdelmalek Essaadi University, Tetouan, Morocco",Conference Paper,Open Access,Scopus,2-s2.0-85062668948
"Brando A., Rodríguez-Serrano J.A., Ciprian M., Maestre R., Vitrià J.","57205697622;26538208800;57205694376;57204770846;7003477071;","Uncertainty modelling in deep networks: Forecasting short and noisy series",2019,"Lecture Notes in Computer Science (including subseries Lecture Notes in Artificial Intelligence and Lecture Notes in Bioinformatics)","11053 LNAI",,,"325","340",,,"10.1007/978-3-030-10997-4_20","https://www.scopus.com/inward/record.uri?eid=2-s2.0-85061131265&doi=10.1007%2f978-3-030-10997-4_20&partnerID=40&md5=32d934560dd38fe2c4cc969c099ca107","BBVA Data and Analytics, Barcelona, Spain; BBVA Data and Analytics, Madrid, Spain; Departament de Matemàtiques i Informàtica, Universitat de Barcelona, Barcelona, Spain","Brando, A., BBVA Data and Analytics, Barcelona, Spain, Departament de Matemàtiques i Informàtica, Universitat de Barcelona, Barcelona, Spain; Rodríguez-Serrano, J.A., BBVA Data and Analytics, Barcelona, Spain; Ciprian, M., BBVA Data and Analytics, Madrid, Spain; Maestre, R., BBVA Data and Analytics, Madrid, Spain; Vitrià, J., Departament de Matemàtiques i Informàtica, Universitat de Barcelona, Barcelona, Spain",Conference Paper,,Scopus,2-s2.0-85061131265
"Sethia A., Raut P.","57205209102;57203153335;","Application of LSTM, GRU and ICA for stock price prediction",2019,"Smart Innovation, Systems and Technologies","107",,,"479","487",,1,"10.1007/978-981-13-1747-7_46","https://www.scopus.com/inward/record.uri?eid=2-s2.0-85059063545&doi=10.1007%2f978-981-13-1747-7_46&partnerID=40&md5=5456523bfa8ee2771d6611ca2bcd87a2","Dwarkadas J. Sanghvi College of Engineering, Mumbai, India","Sethia, A., Dwarkadas J. Sanghvi College of Engineering, Mumbai, India; Raut, P., Dwarkadas J. Sanghvi College of Engineering, Mumbai, India",Conference Paper,,Scopus,2-s2.0-85059063545
"Pawar K., Jalem R.S., Tiwari V.","57204828764;57204832113;56496391800;","Stock Market Price Prediction Using LSTM RNN",2019,"Advances in Intelligent Systems and Computing","841",,,"493","503",,,"10.1007/978-981-13-2285-3_58","https://www.scopus.com/inward/record.uri?eid=2-s2.0-85057427978&doi=10.1007%2f978-981-13-2285-3_58&partnerID=40&md5=2b93f79ac8906e6742573ab27ac710aa","DSPM IIIT, Naya Raipur, India","Pawar, K., DSPM IIIT, Naya Raipur, India; Jalem, R.S., DSPM IIIT, Naya Raipur, India; Tiwari, V., DSPM IIIT, Naya Raipur, India",Conference Paper,,Scopus,2-s2.0-85057427978
"Niño J., Hernandez G., Arévalo A., Leon D., Sandoval J.","57190225431;35897064300;57190281278;57195350225;56311250400;","CNN with limit order book data for stock price prediction",2019,"Advances in Intelligent Systems and Computing","880",,,"444","457",,,"10.1007/978-3-030-02686-8_34","https://www.scopus.com/inward/record.uri?eid=2-s2.0-85055911654&doi=10.1007%2f978-3-030-02686-8_34&partnerID=40&md5=b4190ee83040f8cabc0d9e835c681154","Universidad Nacional de Colombia, Bogotá, Colombia; Universidad Externado de Colombia, Bogotá, Colombia","Niño, J., Universidad Nacional de Colombia, Bogotá, Colombia; Hernandez, G., Universidad Nacional de Colombia, Bogotá, Colombia; Arévalo, A., Universidad Nacional de Colombia, Bogotá, Colombia; Leon, D., Universidad Externado de Colombia, Bogotá, Colombia; Sandoval, J., Universidad Externado de Colombia, Bogotá, Colombia",Conference Paper,,Scopus,2-s2.0-85055911654
"Althelaya K.A., El-Alfy E.-S.M., Mohammed S.","57202503786;7003943902;7102894386;","Stock Market Forecast Using Multivariate Analysis with Bidirectional and Stacked (LSTM, GRU)",2018,"21st Saudi Computer Society National Computer Conference, NCC 2018",,, 8593076,"","",,,"10.1109/NCG.2018.8593076","https://www.scopus.com/inward/record.uri?eid=2-s2.0-85061485605&doi=10.1109%2fNCG.2018.8593076&partnerID=40&md5=1800fd3a7bac4080c421c563152a90a5","Department of Information and Computer Science, College of Computer Sciences and Engineering, King Fahd University of Petroleum and Minerals, Dhahran, 31261, Saudi Arabia","Althelaya, K.A., Department of Information and Computer Science, College of Computer Sciences and Engineering, King Fahd University of Petroleum and Minerals, Dhahran, 31261, Saudi Arabia; El-Alfy, E.-S.M., Department of Information and Computer Science, College of Computer Sciences and Engineering, King Fahd University of Petroleum and Minerals, Dhahran, 31261, Saudi Arabia; Mohammed, S., Department of Information and Computer Science, College of Computer Sciences and Engineering, King Fahd University of Petroleum and Minerals, Dhahran, 31261, Saudi Arabia",Conference Paper,,Scopus,2-s2.0-85061485605
"Baek Y., Kim H.Y.","57202960071;57200074208;","ModAugNet: A new forecasting framework for stock market index value with an overfitting prevention LSTM module and a prediction LSTM module",2018,"Expert Systems with Applications","113",,,"457","480",,2,"10.1016/j.eswa.2018.07.019","https://www.scopus.com/inward/record.uri?eid=2-s2.0-85049969159&doi=10.1016%2fj.eswa.2018.07.019&partnerID=40&md5=08712e647976ca327f91763d9bce54a9","Department of Financial Engineering, Ajou University, Worldcupro 206, Yeongtong-gu, Suwon, 16499, South Korea; Department of Data Science, Ajou University, Worldcupro 206, Yeongtong-gu, Suwon, 16499, South Korea","Baek, Y., Department of Financial Engineering, Ajou University, Worldcupro 206, Yeongtong-gu, Suwon, 16499, South Korea; Kim, H.Y., Department of Financial Engineering, Ajou University, Worldcupro 206, Yeongtong-gu, Suwon, 16499, South Korea, Department of Data Science, Ajou University, Worldcupro 206, Yeongtong-gu, Suwon, 16499, South Korea",Article,,Scopus,2-s2.0-85049969159
"Wang Y., Liu Y., Wang M., Liu R.","57205507649;57205509553;55561302000;36606572600;","LSTM Model Optimization on Stock Price Forecasting",2018,"Proceedings - 2018 17th International Symposium on Distributed Computing and Applications for Business Engineering and Science, DCABES 2018",,, 8572550,"173","177",,,"10.1109/DCABES.2018.00052","https://www.scopus.com/inward/record.uri?eid=2-s2.0-85060291651&doi=10.1109%2fDCABES.2018.00052&partnerID=40&md5=54730e1ce60ace450e876f689e6f1c7d","College of Mathematics and Computer Science, Fuzhou University, Fuzhou, 350116, China","Wang, Y., College of Mathematics and Computer Science, Fuzhou University, Fuzhou, 350116, China; Liu, Y., College of Mathematics and Computer Science, Fuzhou University, Fuzhou, 350116, China; Wang, M., College of Mathematics and Computer Science, Fuzhou University, Fuzhou, 350116, China; Liu, R., College of Mathematics and Computer Science, Fuzhou University, Fuzhou, 350116, China",Conference Paper,,Scopus,2-s2.0-85060291651
"Gurav U., Sidnal N.","36052794200;24462689600;","Adaptive Stock Forecasting Model using Modified Backpropagation Neural Network (MBNN)",2018,"Proceedings of the International Conference on Computational Techniques, Electronics and Mechanical Systems, CTEMS 2018",,, 8769290,"380","385",,,"10.1109/CTEMS.2018.8769290","https://www.scopus.com/inward/record.uri?eid=2-s2.0-85070385176&doi=10.1109%2fCTEMS.2018.8769290&partnerID=40&md5=43d67f8ddceae46d054a312aca6f7c59","Dept. of Information Technology, KIT's College of Engineering, Kolhapur, India; CSE Board, India","Gurav, U., Dept. of Information Technology, KIT's College of Engineering, Kolhapur, India; Sidnal, N., CSE Board, India",Conference Paper,,Scopus,2-s2.0-85070385176
"Kumar S., Ningombam D.","57209548409;57200762188;","Short-Term Forecasting of Stock Prices Using Long Short Term Memory",2018,"Proceedings - 2018 International Conference on Information Technology, ICIT 2018",,, 8724351,"182","186",,,"10.1109/ICIT.2018.00046","https://www.scopus.com/inward/record.uri?eid=2-s2.0-85067436089&doi=10.1109%2fICIT.2018.00046&partnerID=40&md5=f25cef2ce8ff0f7f2d7777fe615bda57","Department of Computer Science and Engineering, Sikkim Manipal Institute of Technology, Rangpo, 737136, India","Kumar, S., Department of Computer Science and Engineering, Sikkim Manipal Institute of Technology, Rangpo, 737136, India; Ningombam, D., Department of Computer Science and Engineering, Sikkim Manipal Institute of Technology, Rangpo, 737136, India",Conference Paper,,Scopus,2-s2.0-85067436089
"Manurung A.H., Budiharto W., Prabowo H.","57207622302;36069151100;57210847043;","Algorithm and modeling of stock prices forecasting based on long short-term memory (LSTM)",2018,"ICIC Express Letters","12","12",,"1277","1283",,,"10.24507/icicel.12.12.1277","https://www.scopus.com/inward/record.uri?eid=2-s2.0-85062649597&doi=10.24507%2ficicel.12.12.1277&partnerID=40&md5=8dc84360c4a58b4b41aa2bc08ec5d4d8","Management Department, BINUS Business School, Bina Nusantara University, Jl. K. H. Syahdan No. 9, DKI, Jakarta, 11480, Indonesia; Computer Science Department, School of Computer Science, Bina Nusantara University, Jl. K. H. Syahdan No. 9, DKI, Jakarta, 11480, Indonesia; Computer Science Department, Bina Nusantara University, Jl. K. H. Syahdan No. 9, DKI, Jakarta, 11480, Indonesia","Manurung, A.H., Management Department, BINUS Business School, Bina Nusantara University, Jl. K. H. Syahdan No. 9, DKI, Jakarta, 11480, Indonesia; Budiharto, W., Computer Science Department, School of Computer Science, Bina Nusantara University, Jl. K. H. Syahdan No. 9, DKI, Jakarta, 11480, Indonesia; Prabowo, H., Computer Science Department, Bina Nusantara University, Jl. K. H. Syahdan No. 9, DKI, Jakarta, 11480, Indonesia",Article,,Scopus,2-s2.0-85062649597
"Tsang G., Deng J., Xie X.","57205363535;55922714500;7402761335;","Recurrent Neural Networks for Financial Time-Series Modelling",2018,"Proceedings - International Conference on Pattern Recognition","2018-August",, 8545666,"892","897",,,"10.1109/ICPR.2018.8545666","https://www.scopus.com/inward/record.uri?eid=2-s2.0-85059781356&doi=10.1109%2fICPR.2018.8545666&partnerID=40&md5=63a2fd52394522fad4c748b5415d4dca","Computer Science Department, Swansea University, United Kingdom","Tsang, G., Computer Science Department, Swansea University, United Kingdom; Deng, J., Computer Science Department, Swansea University, United Kingdom; Xie, X., Computer Science Department, Swansea University, United Kingdom",Conference Paper,,Scopus,2-s2.0-85059781356
"Day M.-Y., Lin J.-T., Chen Y.-C.","14031006200;57204820145;57204820974;","Artificial intelligence for conversational robo-advisor",2018,"Proceedings of the 2018 IEEE/ACM International Conference on Advances in Social Networks Analysis and Mining, ASONAM 2018",,, 8508269,"1057","1064",,,"10.1109/ASONAM.2018.8508269","https://www.scopus.com/inward/record.uri?eid=2-s2.0-85057319854&doi=10.1109%2fASONAM.2018.8508269&partnerID=40&md5=2412bb1d11dee3c145908afb240cfb95","Department of Information Management, Tamkang University, Taiwan, Taiwan","Day, M.-Y., Department of Information Management, Tamkang University, Taiwan, Taiwan; Lin, J.-T., Department of Information Management, Tamkang University, Taiwan, Taiwan; Chen, Y.-C., Department of Information Management, Tamkang University, Taiwan, Taiwan",Conference Paper,,Scopus,2-s2.0-85057319854
"Machado E.J., Pereira A.C.M.","57192673413;35579191200;","Proposal and implementation of machine learning models for stock markets using web data",2018,"WebMedia 2018 - Proceedings of the 24th Brazilian Symposium on Multimedia and the Web",,,,"61","64",,,"10.1145/3243082.3264663","https://www.scopus.com/inward/record.uri?eid=2-s2.0-85056713060&doi=10.1145%2f3243082.3264663&partnerID=40&md5=5fdb34fd55c174be2aea52ebfd616ff7","Federal Center for Tech. Education of MG, Belo Horizonte, Minas Gerais, Brazil; Federal University of Minas Gerais (UFMG), Belo Horizonte, Minas Gerais, Brazil","Machado, E.J., Federal Center for Tech. Education of MG, Belo Horizonte, Minas Gerais, Brazil; Pereira, A.C.M., Federal University of Minas Gerais (UFMG), Belo Horizonte, Minas Gerais, Brazil",Conference Paper,,Scopus,2-s2.0-85056713060
"Fischer T., Krauss C.","55757780995;57189242463;","Deep learning with long short-term memory networks for financial market predictions",2018,"European Journal of Operational Research","270","2",,"654","669",,49,"10.1016/j.ejor.2017.11.054","https://www.scopus.com/inward/record.uri?eid=2-s2.0-85039970639&doi=10.1016%2fj.ejor.2017.11.054&partnerID=40&md5=ac3b57da8599cac8f14f9a3588ba885d","Department of Statistics and Econometrics, University of Erlangen-Nürnberg, Lange Gasse 20, Nürnberg, 90403, Germany","Fischer, T., Department of Statistics and Econometrics, University of Erlangen-Nürnberg, Lange Gasse 20, Nürnberg, 90403, Germany; Krauss, C., Department of Statistics and Econometrics, University of Erlangen-Nürnberg, Lange Gasse 20, Nürnberg, 90403, Germany",Article,,Scopus,2-s2.0-85039970639
"Pereira D.F.R., Junior N.N.D.M., Caloba L.P.","57204639812;57204645429;24282923400;","Financial Time Series Forecasting Using Non-Linear Methods and Stacked Autoencoders",2018,"Proceedings of the International Joint Conference on Neural Networks","2018-July",, 8489425,"","",,,"10.1109/IJCNN.2018.8489425","https://www.scopus.com/inward/record.uri?eid=2-s2.0-85056525695&doi=10.1109%2fIJCNN.2018.8489425&partnerID=40&md5=8f97d8879b71aacf283f9c3c82d6e298","Signal Processing Laboratory, Polytechnical School-Federal University of Rio de Janeiro, Rio de Janeiro, RJ, Brazil","Pereira, D.F.R., Signal Processing Laboratory, Polytechnical School-Federal University of Rio de Janeiro, Rio de Janeiro, RJ, Brazil; Junior, N.N.D.M., Signal Processing Laboratory, Polytechnical School-Federal University of Rio de Janeiro, Rio de Janeiro, RJ, Brazil; Caloba, L.P., Signal Processing Laboratory, Polytechnical School-Federal University of Rio de Janeiro, Rio de Janeiro, RJ, Brazil",Conference Paper,,Scopus,2-s2.0-85056525695
"Jiang X., Pan S., Jiang J., Long G.","57013726600;55522732400;55731807500;55522990400;","Cross-Domain Deep Learning Approach for Multiple Financial Market Prediction",2018,"Proceedings of the International Joint Conference on Neural Networks","2018-July",, 8489360,"","",,,"10.1109/IJCNN.2018.8489360","https://www.scopus.com/inward/record.uri?eid=2-s2.0-85056490365&doi=10.1109%2fIJCNN.2018.8489360&partnerID=40&md5=73208f0dd2689c862f4c839386efe2e0","Centre for Artificial Intelligence, School of Software Faculty of Engineering and Information Technology, University of Technology, Sydney, Australia","Jiang, X., Centre for Artificial Intelligence, School of Software Faculty of Engineering and Information Technology, University of Technology, Sydney, Australia; Pan, S., Centre for Artificial Intelligence, School of Software Faculty of Engineering and Information Technology, University of Technology, Sydney, Australia; Jiang, J., Centre for Artificial Intelligence, School of Software Faculty of Engineering and Information Technology, University of Technology, Sydney, Australia; Long, G., Centre for Artificial Intelligence, School of Software Faculty of Engineering and Information Technology, University of Technology, Sydney, Australia",Conference Paper,,Scopus,2-s2.0-85056490365
"Yao S., Luo L., Peng H.","57204428087;17345995600;9732506800;","High-frequency stock trend forecast using LSTM model",2018,"13th International Conference on Computer Science and Education, ICCSE 2018",,, 8468703,"293","296",,,"10.1109/ICCSE.2018.8468703","https://www.scopus.com/inward/record.uri?eid=2-s2.0-85055483678&doi=10.1109%2fICCSE.2018.8468703&partnerID=40&md5=87c36e4d47cef3084769cd98b1514304","Xiamen University, Department of Automation, Xiamen, China","Yao, S., Xiamen University, Department of Automation, Xiamen, China; Luo, L., Xiamen University, Department of Automation, Xiamen, China; Peng, H., Xiamen University, Department of Automation, Xiamen, China",Conference Paper,,Scopus,2-s2.0-85055483678
"Chen Y., Wu J., Bu H.","57204076092;57204072042;57204073569;","Stock Market Embedding and Prediction: A Deep Learning Method",2018,"2018 15th International Conference on Service Systems and Service Management, ICSSSM 2018",,, 8464968,"","",,,"10.1109/ICSSSM.2018.8464968","https://www.scopus.com/inward/record.uri?eid=2-s2.0-85054354418&doi=10.1109%2fICSSSM.2018.8464968&partnerID=40&md5=ee5f0b79628055726543e835ba28b213","School of Economics and Management, Beihang University, Beijing, China; Beijing Key Laboratory of Emergency Support, Simulation Technologies for City Operations, Beijing, China; Beijing Advanced Innovation Center for Big Data and Brain Computing, Beihang University, Beijing, China","Chen, Y., School of Economics and Management, Beihang University, Beijing, China, Beijing Key Laboratory of Emergency Support, Simulation Technologies for City Operations, Beijing, China; Wu, J., School of Economics and Management, Beihang University, Beijing, China, Beijing Advanced Innovation Center for Big Data and Brain Computing, Beihang University, Beijing, China; Bu, H., School of Economics and Management, Beihang University, Beijing, China",Conference Paper,,Scopus,2-s2.0-85054354418
"Sezer O.B., Ozbayoglu A.M.","57207586168;6505999525;","Algorithmic financial trading with deep convolutional neural networks: Time series to image conversion approach",2018,"Applied Soft Computing Journal","70",,,"525","538",,7,"10.1016/j.asoc.2018.04.024","https://www.scopus.com/inward/record.uri?eid=2-s2.0-85048331794&doi=10.1016%2fj.asoc.2018.04.024&partnerID=40&md5=eda5e0eb866c3d90e39146b522f49a85","TOBB University of Economics and Technology, Ankara, 06560, Turkey","Sezer, O.B., TOBB University of Economics and Technology, Ankara, 06560, Turkey; Ozbayoglu, A.M., TOBB University of Economics and Technology, Ankara, 06560, Turkey",Article,,Scopus,2-s2.0-85048331794
"Yan H., Ouyang H.","57198790516;35269370400;","Financial Time Series Prediction Based on Deep Learning",2018,"Wireless Personal Communications","102","2",,"683","700",,3,"10.1007/s11277-017-5086-2","https://www.scopus.com/inward/record.uri?eid=2-s2.0-85037095689&doi=10.1007%2fs11277-017-5086-2&partnerID=40&md5=5147fe533db6fb35ee507c8621585fde","School of Economics, Huazhong University of Science and Technology, 1037 Luoyu Road, Wuhan, Hubei, China","Yan, H., School of Economics, Huazhong University of Science and Technology, 1037 Luoyu Road, Wuhan, Hubei, China; Ouyang, H., School of Economics, Huazhong University of Science and Technology, 1037 Luoyu Road, Wuhan, Hubei, China",Article,,Scopus,2-s2.0-85037095689
"Alkhoshi E., Belkasim S.","57205116311;6603864907;","Stable stock market prediction using NARX algorithm",2018,"ACM International Conference Proceeding Series",,,,"62","66",,,"10.1145/3277104.3277120","https://www.scopus.com/inward/record.uri?eid=2-s2.0-85058627874&doi=10.1145%2f3277104.3277120&partnerID=40&md5=57398d936e3cb9aec0619c8188b9e77e","Department of Computer Science, Georgia State University, Atlanta, GA, United States","Alkhoshi, E., Department of Computer Science, Georgia State University, Atlanta, GA, United States; Belkasim, S., Department of Computer Science, Georgia State University, Atlanta, GA, United States",Conference Paper,,Scopus,2-s2.0-85058627874
"Chiong R., Adam M.T.P., Fan Z., Lutz B., Hu Z., Neumann D.","23395951300;44061092000;57007544300;57190262132;55838947300;7202067244;","A sentiment analysis-based machine learning approach for financial market prediction via news disclosures",2018,"GECCO 2018 Companion - Proceedings of the 2018 Genetic and Evolutionary Computation Conference Companion",,,,"278","279",,6,"10.1145/3205651.3205682","https://www.scopus.com/inward/record.uri?eid=2-s2.0-85051531626&doi=10.1145%2f3205651.3205682&partnerID=40&md5=38ee7592b16b573853e0bd339fd22130","University of Newcastle, Callaghan, NSW  2308, Australia; University of Freiburg, Freiburg, 79085, Germany; Wuhan University, Wuhan, 430072, China","Chiong, R., University of Newcastle, Callaghan, NSW  2308, Australia; Adam, M.T.P., University of Newcastle, Callaghan, NSW  2308, Australia; Fan, Z., University of Newcastle, Callaghan, NSW  2308, Australia; Lutz, B., University of Freiburg, Freiburg, 79085, Germany; Hu, Z., Wuhan University, Wuhan, 430072, China; Neumann, D., University of Freiburg, Freiburg, 79085, Germany",Conference Paper,,Scopus,2-s2.0-85051531626
"Du S., Li T., Horng S.-J.","57194798613;7406372548;35585485600;","Time Series Forecasting Using Sequence-to-Sequence Deep Learning Framework",2018,"Proceedings - International Symposium on Parallel Architectures, Algorithms and Programming, PAAP","2018-December",, 8701741,"171","176",,,"10.1109/PAAP.2018.00037","https://www.scopus.com/inward/record.uri?eid=2-s2.0-85065636375&doi=10.1109%2fPAAP.2018.00037&partnerID=40&md5=382c214b5d7adbeac4747b8ec72e8180","School of Information Science and Technology, Southwest Jiaotong University, Chengdu, 611756, China; Department of Computer Science and Information Engineering, National Taiwan University of Science and Technology, Taiwan","Du, S., School of Information Science and Technology, Southwest Jiaotong University, Chengdu, 611756, China; Li, T., School of Information Science and Technology, Southwest Jiaotong University, Chengdu, 611756, China; Horng, S.-J., Department of Computer Science and Information Engineering, National Taiwan University of Science and Technology, Taiwan",Conference Paper,,Scopus,2-s2.0-85065636375
"Katarya R., Mahajan A.","35810442400;57208733585;","A survey of neural network techniques in market trend analysis",2018,"Proceedings of the International Conference on Intelligent Sustainable Systems, ICISS 2017",,,,"873","877",,,"10.1109/ISS1.2017.8389302","https://www.scopus.com/inward/record.uri?eid=2-s2.0-85050027999&doi=10.1109%2fISS1.2017.8389302&partnerID=40&md5=752a5b6c4d8a3ce8b07e99860c22f457","Department of Information Technology, Delhi Technological University, Shahbad Daulatpur, Bawana Road, Delhi - 42, India","Katarya, R., Department of Information Technology, Delhi Technological University, Shahbad Daulatpur, Bawana Road, Delhi - 42, India; Mahajan, A., Department of Information Technology, Delhi Technological University, Shahbad Daulatpur, Bawana Road, Delhi - 42, India",Conference Paper,,Scopus,2-s2.0-85050027999
"Zhang R., Yuan Z., Shao X.","56402104400;57203940881;7202920566;","A New Combined CNN-RNN Model for Sector Stock Price Analysis",2018,"Proceedings - International Computer Software and Applications Conference","2",, 8377920,"546","551",,,"10.1109/COMPSAC.2018.10292","https://www.scopus.com/inward/record.uri?eid=2-s2.0-85055477715&doi=10.1109%2fCOMPSAC.2018.10292&partnerID=40&md5=e4aaea0763cd4676186c4d8a2affd78d","MIT Laboratory for Financial Engineering, Cambridge, MA, United States; College of Computer and Control Engineering, Nankai University, Tianjin, China","Zhang, R., MIT Laboratory for Financial Engineering, Cambridge, MA, United States; Yuan, Z., College of Computer and Control Engineering, Nankai University, Tianjin, China; Shao, X., College of Computer and Control Engineering, Nankai University, Tianjin, China",Conference Paper,,Scopus,2-s2.0-85055477715
"Zhao Z., Rao R., Tu S., Shi J.","57195064100;7403068844;57202467255;57202460505;","Time-weighted lstm model with redefined labeling for stock trend prediction",2018,"Proceedings - International Conference on Tools with Artificial Intelligence, ICTAI","2017-November",,,"1210","1217",,4,"10.1109/ICTAI.2017.00184","https://www.scopus.com/inward/record.uri?eid=2-s2.0-85048469315&doi=10.1109%2fICTAI.2017.00184&partnerID=40&md5=5c4ed2a27e2dd2f3f7530705fc76fd2b","Shanghai Jiao Tong University, Shanghai, China; Shanghai Rongshi Investment Management Co Ltd, Shanghai, China","Zhao, Z., Shanghai Jiao Tong University, Shanghai, China; Rao, R., Shanghai Jiao Tong University, Shanghai, China; Tu, S., Shanghai Jiao Tong University, Shanghai, China; Shi, J., Shanghai Rongshi Investment Management Co Ltd, Shanghai, China",Conference Paper,,Scopus,2-s2.0-85048469315
